,State,City,Blank,Program name,ID,Status,ERAS link
0,AL,Birmingham,,University of Alabama Medical Center Program,0400121010,Participating,https://www.uab.edu/medicine/anesthesiology/
1,AR,Little Rock,,University of Arkansas for Medical Sciences (UAMS) College of Medicine Program,0400421013,Participating,https://medicine.uams.edu/anesthesiology/residency/
2,AZ,Phoenix,,Mayo Clinic College of Medicine and Science (Arizona) Program,0400331197,Participating,http://www.mayo.edu/msgme/residencies-fellowships/anesthesiology/anesthesiology-residency-arizona
3,AZ,Tucson,,University of Arizona College of Medicine-Tucson Program,0400321012,Not Participating,
4,CA,Loma Linda,,Loma Linda University Health Education Consortium Program,0400521016,Participating,http://www.lluanesthesia.com
5,CA,Los Angeles,,Cedars-Sinai Medical Center Program,0400521019,Participating,
6,CA,Los Angeles,,UCLA David Geffen School of Medicine/UCLA Medical Center Program,0400521020,Participating,https://www.uclahealth.org/anes
7,CA,Los Angeles,,University of Southern California/LAC+USC Medical Center Program,0400521018,Participating,http://keck.usc.edu/anesthesiology
8,CA,Moreno Valley,,Riverside University Health System Program,0400500027,Participating,https://www.ruhealth.org/medical-center/medical-training/anesthesiology-residency
9,CA,Orange,,University of California (Irvine) Program,0400521015,Participating,http://www.anesthesiology.uci.edu/
10,CA,Riverside,,Riverside Community Hospital Program,0400500031,Participating,http://gme.riversidecommunityhospital.com
11,CA,Sacramento,,University of California Davis Health Program,0400521014,Participating,http://www.ucdmc.ucdavis.edu/anesthesiology/education/residency
12,CA,San Diego,,University of California (San Diego) Medical Center Program,0400521022,Participating,http://anes-som.ucsd.edu/
13,CA,San Francisco,,University of California (San Francisco) Program,0400521023,Participating,http://www.anesthesia.ucsf.edu/
14,CA,Stanford,,Stanford Health Care-Sponsored Stanford University Program,0400521025,Participating,http://www.med.stanford.edu/anesthesia/
15,CA,Stockton,,St Joseph's Medical Center Program,0400500030,Not Participating,
16,CA,Torrance,,Los Angeles County-Harbor-UCLA Medical Center Program,0400511026,Participating,http://www.harbor-ucla.org/anesthesiology/
17,CA,Visalia,,Kaweah Delta Health Care District (KDHCD) Program,0400500028,Participating,https://www.kaweahdelta.org/GME-Residency-Programs/Anesthesiology.aspx
18,CO,Aurora,,University of Colorado Program,0400721028,Participating,http://www.ucdenver.edu/academics/colleges/medicalschool/departments/Anesthesiology/Education/residency/Pages/Residency.aspx
19,CT,Farmington,,University of Connecticut Program,0400821172,Participating,https://health.uconn.edu/graduate-medical-education/anesthesiology-residency-program/
20,CT,New Haven,,Yale-New Haven Medical Center Program,0400821030,Participating,http://medicine.yale.edu/anesthesiology
21,DC,Washington,,George Washington University Program,0401021033,Not Participating,
22,DC,Washington,,MedStar Health/Georgetown University Hospital Program,0401021032,Participating,http://anesthesiology.georgetown.edu/
23,FL,Brooksville,,HCA Healthcare/USF Morsani College of Medicine GME: Oak Hill Hospital Program,0401100211,Participating,
24,FL,Gainesville,,University of Florida Program,0401121035,Participating,https://anest.ufl.edu/education/residency/
25,FL,Jacksonville,,Mayo Clinic College of Medicine and Science (Jacksonville) Program,0401113194,Participating,http://www.mayo.edu/msgme
26,FL,Jacksonville,,University of Florida College of Medicine Jacksonville Program,0401112204,Participating,http://www.hscj.ufl.edu/anesthesiology/residency/
27,FL,Miami,,HCA Healthcare: East Florida Division GME: Kendall Regional Medical Center Program,0401100206,Participating,http://kendallmed.com/professionals/graduate-medical-education/
28,FL,Miami,,University of Miami/Jackson Health System Program,0401121036,Participating,http://anesthesiology.med.miami.edu
29,FL,Miami Beach,,"Mount Sinai Medical Center of Florida, Inc Program",0401100205,Participating,http://www.msmc.com
30,FL,Ocala,,University of Central Florida/HCA Healthcare GME (Ocala) Program,0401100212,Participating,https://ocalahealthsystem.com/physicians/graduate-medical-education/anesthesiology/
31,FL,Pembroke Pines,,"Memorial Healthcare System, Hollywood, Florida Program",0401100215,Participating,https://www.mhs.net/medical-professionals/education/residency-programs/
32,FL,Plantation,,HCA Healthcare: East Florida Division GME Program,0401100001,Participating,https://westsideregional.com/physicians/graduate-medical-education/
33,FL,South Miami,,Larkin Community Hospital Program,0401100213,Participating,http://www.graduatemedicaleducation.org/anesthesiology-residency-program/
34,FL,Weston,,Cleveland Clinic Florida Program,0401100209,Participating,
35,GA,Atlanta,,Emory University School of Medicine Program,0401221037,Not Participating,
36,GA,Augusta,,Medical College of Georgia Program,0401211038,Participating,https://www.augusta.edu/mcg/anes/
37,IA,Iowa City,,University of Iowa Hospitals and Clinics Program,0401821049,Participating,https://gme.medicine.uiowa.edu/anesthesiology-residency
38,IL,Chicago,,Advocate Health Care (Advocate Illinois Masonic Medical Center) Program,0401621040,Participating,https://tinyurl.com/y75ughez
39,IL,Chicago,,"Cook County Health and Hospitals System Program
 Osteopathic Recognized!",0401612039,Participating,https://www.cookcountyhhs.org/medical-clinicalservices/anesthesiology/
40,IL,Chicago,,McGaw Medical Center of Northwestern University Program,0401621042,Participating,http://www.feinberg.northwestern.edu/sites/anesthesiology/
41,IL,Chicago,,Rush University Medical Center Program,0401621043,Participating,http://www.rushu.rush.edu/rush-medical-college/departments/anesthesiology
42,IL,Chicago,,University of Chicago Program,0401611044,Participating,http://anesthesiaresidents.uchicago.edu/
43,IL,Chicago,,University of Illinois College of Medicine at Chicago Program,0401611041,Participating,https://chicago.medicine.uic.edu/departments/academic-departments/anesthesiology/
44,IL,Maywood,,Loyola University Medical Center Program,0401611046,Participating,http://www.stritch.luc.edu/anesthesiology/
45,IN,Indianapolis,,Indiana University School of Medicine Program,0401721048,Participating,https://medicine.iu.edu/departments/anesthesia/education-programs/residency/
46,KS,Kansas City,,University of Kansas School of Medicine Program,0401911050,Participating,http://www.kumc.edu/anes
47,KS,Wichita,,University of Kansas (Wichita) Program,0401922051,Participating,http://wichita.kumc.edu/anes
48,KY,Lexington,,University of Kentucky College of Medicine Program,0402021052,Participating,http://www.wildcatanesthesia.com
49,KY,Louisville,,University of Louisville School of Medicine Program,0402021053,Participating,http://anesthesiology.louisville.edu/
50,LA,New Orleans,,Louisiana State University Program,0402131199,Participating,http://www.medschool.lsuhsc.edu/anesthesiology
51,LA,New Orleans,,Ochsner Clinic Foundation Program,0402112055,Participating,https://education.ochsner.org/gme/training-programs/anesthesiology-residency#:~:text=Anesthesiology Residency. The Accredi
52,LA,New Orleans,,Tulane University Program,0402131168,Participating,https://medicine.tulane.edu/departments/anesthesiology
53,LA,Shreveport,,Louisiana State University (Shreveport) Program,0402111056,Participating,https://www.lsuhs.edu/departments/school-of-medicine/anesthesiology
54,MA,Boston,,Beth Israel Deaconess Medical Center Program,0402411060,Participating,https://www.bidmc.org/medical-education/medical-education-by-department/anesthesia-critical-care-and-pain-medicine
55,MA,Boston,,Boston University Medical Center Program,0402421062,Participating,https://www.bmc.org/anesthesia/education/anesthesia-residency-program
56,MA,Boston,,Brigham and Women's Hospital Program,0402421066,Participating,http://www.brighamandwomens.org/Departments_and_Services/anesthesiology/Residency/default.aspx?sub=1&sub=0
57,MA,Boston,,Massachusetts General Hospital Program,0402431064,Participating,https://ether.mgh.harvard.edu/applicants
58,MA,Boston,,St Elizabeth's Medical Center Program,0402421067,Not Participating,
59,MA,Boston,,Tufts Medical Center Program,0402421065,Participating,https://www.tuftsmedicalcenter.org/patient-care-services/departments-and-services/anesthesiology/training-education/anesthesiolo
60,MA,Burlington,,Lahey Clinic Program,0402400071,Participating,https://www.lahey.org
61,MA,Springfield,,UMMS-Baystate Program,0402412069,Participating,http://www.baystatehealth.com/anesresidency
62,MA,Worcester,,University of Massachusetts Program,0402431070,Participating,http://www.umassmed.edu/anes
63,MD,Baltimore,,Johns Hopkins University Program,0402321058,Participating,http://www.hopkinsmedicine.org/anesthesiology/
64,MD,Baltimore,,University of Maryland Program,0402311059,Participating,http://medschool.umaryland.edu/anesthesiology/
65,ME,Portland,,Maine Medical Center Program,0402211057,Participating,http://www.mmc.org/anesthesiology-residency-maine-medical-center
66,MI,Ann Arbor,,University of Michigan Health System Program,0402521071,Participating,http://anes.med.umich.edu/
67,MI,Detroit,,Detroit Medical Center/Wayne State University Program,0402531073,Participating,http://www.dmc.org/AnesthesiologyResidency
68,MI,Detroit,,Henry Ford Hospital Program,0402521185,Participating,http://www.henryford.com/body_program.cfm?id=37257
69,MI,Lansing,,McLaren Health Care/Greater Lansing/MSU Program,0402500208,Participating,https://www.mclaren.org/gme-medical-education/mclaren-residency-programs/35
70,MI,Pontiac,,McLaren Health Care/Oakland/MSU Program,0402500207,Participating,https://www.mclaren.org/gme-medical-education/mclaren-residency-programs/29
71,MI,Pontiac,,Wayne State University School of Medicine Program,0402500206,Participating,http://anesthesiology.med.wayne.edu/
72,MI,Royal Oak,,Beaumont Health (Royal Oak) Program,0402513202,Participating,https://www.beaumont.edu/graduate-medical-education/residency-programs/anesthesiology
73,MN,Minneapolis,,University of Minnesota Program,0402631075,Participating,http://www.anesthesiology.umn.edu
74,MN,Rochester,,Mayo Clinic College of Medicine and Science (Rochester) Program,0402621076,Participating,http://www.mayo.edu/msgme/residencies-fellowships/anesthesiology/anesthesiology-residency-minnesota
75,MO,Columbia,,University of Missouri-Columbia Program,0402811078,Participating,https://medicine.missouri.edu/departments/anesthesiology-and-perioperative-medicine
76,MO,Kansas City,,University of Missouri-Kansas City School of Medicine Program,0402812080,Not Participating,
77,MO,St Louis,,Washington University/B-JH/SLCH Consortium Program,0402811081,Participating,http://www.anest.wustl.edu
78,MO,St. Louis,,St Louis University School of Medicine Program,0402821166,Participating,https://www.slu.edu/medicine/anesthesiology-critical-care/
79,MS,Jackson,,University of Mississippi Medical Center Program,0402711077,Participating,http://www.umc.edu/anesthesiology/
80,NC,Chapel Hill,,University of North Carolina Hospitals Program,0403621114,Participating,https://www.med.unc.edu/anesthesiology
81,NC,Durham,,Duke University Hospital Program,0403631115,Participating,https://anesthesiology.duke.edu/?page_id=818689
82,NC,Winston-Salem,,Wake Forest University School of Medicine Program,0403621116,Participating,http://www.wakehealth.edu/School/Anesthesiology/Residency.htm
83,NE,Omaha,,University of Nebraska Medical Center College of Medicine Program,0403011082,Participating,http://www.unmc.edu/anesthesia
84,NH,Lebanon,,Dartmouth-Hitchcock/Mary Hitchcock Memorial Hospital Program,0403211083,Participating,http://gme.dartmouth-hitchcock.org/anesthesiology
85,NJ,Camden,,Cooper Medical School of Rowan University/Cooper University Hospital Program,0403311195,Participating,https://www.cooperhealth.edu/residencies/anesthesiology
86,NJ,Hackensack,,Hackensack University Medical Center Program,0403300196,Participating,https://www.hackensackumc.org
87,NJ,New Brunswick,,Rutgers Health/Robert Wood Johnson Medical School Program,0403321180,Participating,http://rwjms.rutgers.edu/departments_institutes/anesthesiology/fellowship/pain.html
88,NJ,Newark,,Rutgers Health/New Jersey Medical School Program,0403321087,Participating,
89,NJ,Paterson,,St Joseph's University Medical Center Program,0403321089,Participating,http://www.stjosephshealth.org
90,NM,Albuquerque,,University of New Mexico School of Medicine Program,0403421183,Participating,http://anesthesiology.unm.edu
91,NV,Las Vegas,,HCA Healthcare Sunrise Health Graduate Medical Education Program,0403100001,Participating,https://mountainview-hospital.com/physicians/graduate-medical-education/anesthesiology/
92,NY,Albany,,Albany Medical Center Program,0403521167,Participating,https://www.amc.edu/academic/GMENew/Anesthesiology/anesthesiology.cfm
93,NY,Bronx,,Montefiore Medical Center/Albert Einstein College of Medicine Program,0403521181,Participating,http://www.montefiore.org/anesthesiology
94,NY,Brooklyn,,Maimonides Medical Center Program,0403511101,Participating,https://maimo.org/medical-education/residency-programs/anesthesiology-residency/
95,NY,Brooklyn,,New York-Presbyterian Brooklyn Methodist Hospital Program,0403511102,Not Participating,
96,NY,Brooklyn,,SUNY Downstate Health Sciences University Program,0403521110,Participating,http://www.downstate.edu
97,NY,Buffalo,,University at Buffalo Program,0403521093,Participating,http://medicine.buffalo.edu/departments/anesthesiology.html
98,NY,New Hyde Park,,Zucker School of Medicine at Hofstra/Northwell Program,0403500182,Participating,https://professionals.northwell.edu/.../residency-anesthesiology-nsuh-lij
99,NY,New York,,Icahn School of Medicine at Mount Sinai (Morningside/West) Program,0403511108,Participating,https://icahn.mssm.edu/education/residencies-fellowships/list/msslw-anesthesiology-residency
100,NY,New York,,Icahn School of Medicine at Mount Sinai (Mount Sinai Hospital) Program,0403521104,Participating,http://www.mssm.edu/departments-and-institutes/anesthesiology
101,NY,New York,,NYU Grossman School of Medicine Program,0403521106,Participating,http://www.med.nyu.edu
102,NY,New York,,New York Medical College at Metropolitan Hospital Program,0403500184,Participating,https://metanesthesiology.com
103,NY,New York,,New York Presbyterian Hospital (Columbia Campus) Program,0403511107,Participating,http://www.cumc.columbia.edu/dept/anesthesiology/education/residency/index.html
104,NY,New York,,New York Presbyterian Hospital (Cornell Campus) Program,0403521098,Participating,https://anesthesiology.weill.cornell.edu/
105,NY,POUGHKEEPSIE,,Nuvance Health Program,0403500183,Participating,https://learning.nuvancehealth.org/
106,NY,Rochester,,University of Rochester Program,0403511111,Participating,https://anesresidency.urmc.edu/
107,NY,Stony Brook,,Stony Brook Medicine/University Hospital Program,0403521170,Participating,http://anesthesia.stonybrook.edu/
108,NY,Syracuse,,SUNY Upstate Medical University Program,0403521113,Participating,http://www.upstate.edu
109,NY,Valhalla,,Westchester Medical Center Program,0403521105,Participating,https://www.westchestermedicalcenter.org/anesthesiology-residency-program
110,OH,Cincinnati,,University of Cincinnati Medical Center/College of Medicine Program,0403821118,Participating,http://med.uc.edu/anesth
111,OH,Cleveland,,Case Western Reserve University/University Hospitals Cleveland Medical Center Program,0403821119,Participating,http://www.uhhospitals.org/case/services/anesthesiology-and-perioperative-medicine/medical-education/anesthesiology-residency
112,OH,Cleveland,,Cleveland Clinic Foundation Program,0403822120,Participating,https://my.clevelandclinic.org/departments/anesthesiology/medical-professionals/residency
113,OH,Cleveland,,The MetroHealth System/Case Western Reserve University Program,0403821174,Not Participating,
114,OH,Columbus,,Ohio State University Hospital Program,0403811123,Participating,http://anesthesiology.osu.edu
115,OH,Columbus,,"OhioHealth/Doctors Hospital Program
 Osteopathic Recognized!",0403800175,Participating,https://www.ohiohealth.com/medical-education/residencies/anesthesiology-doctors-hospital/
116,OH,Dayton,,Kettering Health Network Program,0403800176,Participating,https://www.ketteringhealth.org/grandviewmeded/residency/anesthesiology.cfm
117,OH,Toledo,,University of Toledo Program,0403821125,Participating,http://www.utoledo.edu
118,OH,Warrensville Hts.,,"Cleveland Clinic Foundation/South Pointe Hospital Program
 Osteopathic Recognized!",0403800177,Participating,http://spgme.southpointehospital.org/Programs/Anesthesia/Anesthesiology-Program-Overview
119,OK,Oklahoma City,,University of Oklahoma Health Sciences Center Program,0403921128,Participating,http://www.ouhsc.edu/anesthesiology
120,OK,Tulsa,,"Oklahoma State University Center for Health Sciences Program
					
					 Osteopathic Recognized!",0403900129,Participating,
121,OR,Portland,,Oregon Health & Science University Program,0404021129,Participating,http://www.ohsu.edu/xd/education/schools/school-of-medicine/departments/clinical-departments/anesthesiology/index.cfm
122,PA,Danville,,Geisinger Health System Program,0404100205,Participating,http://www.geisinger.edu/residencies/anesthesia/
123,PA,Hershey,,Penn State Milton S Hershey Medical Center Program,0404111130,Participating,https://residency.med.psu.edu/programs/anesthesiology-residency/
124,PA,Lititz,,"UPMC Medical Education/Lititz Program
 Osteopathic Recognized!",0404100206,Participating,https://www.upmc.com/locations/hospitals/lititz/careers-training/gme
125,PA,Philadelphia,,Sidney Kimmel Medical College at Thomas Jefferson University/TJUH Program,0404121137,Participating,https://www.jefferson.edu/academics/colleges-schools-institutes/skmc/departments/anesthesiology/education/residency.html
126,PA,Philadelphia,,Temple University Hospital Program,0404131136,Participating,http://www.temple.edu/anes
127,PA,Philadelphia,,University of Pennsylvania Health System Program,0404121134,Participating,https://www.pennmedicine.org/departments-and-centers/anesthesiology-and-critical-care/education-and-training/fellowships
128,PA,Pittsburgh,,Allegheny Health Network Medical Education Consortium (AGH/WPH) Program,0404132141,Participating,http://www.ahn.org
129,PA,Pittsburgh,,UPMC Medical Education Program,0404121139,Participating,http://www.anes.upmc.edu
130,PA,Sayre,,Robert Packer Hospital Program,0404100207,Participating,https://www.guthrie.org/anesthesiology-residency-program
131,PA,West Reading,,Tower Health Program,0404100208,Participating,https://reading.towerhealth.org/academics/residency-programs/anesthesiology/
132,PR,San Juan,,University of Puerto Rico Program,0404221142,Participating,http://w3srv3.md.rcm.upr.edu/anesthesiology/
133,RI,Providence,,Brown University/Rhode Island Hospital-Lifespan Program,0404300001,Participating,https://www.brown.edu/academics/medical/anesthesiology/
134,SC,Charleston,,Medical University of South Carolina Program,0404522143,Participating,http://www.musc.edu/anesthesia
135,SC,Myrtle Beach,,HCA Healthcare Grand Strand Regional Medical Center Program,0404500144,Participating,
136,TN,Knoxville,,University of Tennessee Medical Center at Knoxville Program,0404711144,Not Participating,
137,TN,Memphis,,University of Tennessee College of Medicine Program,0404700202,Participating,https://www.uthsc.edu/anesthesiology/
138,TN,Nashville,,Vanderbilt University Medical Center Program,0404711146,Participating,https://www.vumc.org/anesthesiology/residency-program
139,TX,Dallas,,University of Texas Southwestern Medical Center Program,0404821147,Participating,https://residency.utswanesthesia.com
140,TX,Galveston,,University of Texas Medical Branch Hospitals Program,0404811149,Participating,https://www.utmb.edu/anesthesia/home
141,TX,Houston,,Baylor College of Medicine Program,0404831150,Participating,https://www.bcm.edu/departments/anesthesiology/education/anesthesiology-residency
142,TX,Houston,,University of Texas Health Science Center at Houston Program,0404831152,Participating,https://med.uth.edu/anesthesiology/
143,TX,Lubbock,,Texas Tech University Health Sciences Center at Lubbock Program,0404811153,Participating,https://www.ttuhsc.edu/medicine/anesthesiology/default.aspx
144,TX,San Antonio,,University of Texas Health Science Center San Antonio Joe and Teresa Lozano Long School of Medicine Program,0404821155,Participating,http://www.anesthesia.uthscsa.edu/
145,TX,Temple,,Texas A&M College of Medicine-Scott and White Medical Center (Temple) Program,0404821156,Participating,https://www.BSWH.md/AnesthesiologyResidency
146,UT,Salt Lake City,,University of Utah Health Program,0404931157,Participating,http://medicine.utah.edu/anesthesiology/
147,VA,Charlottesville,,University of Virginia Medical Center Program,0405111159,Participating,https://med.virginia.edu/anesthesiology/
148,VA,Richmond,,Virginia Commonwealth University Health System Program,0405111160,Participating,http://www.anesthesiology.vcu.edu
149,VT,Burlington,,University of Vermont Medical Center Program,0405011158,Participating,https://www.uvmhealth.org/gme/Pages/Residencies/Anesthesiology.aspx
150,WA,Seattle,,University of Washington Program,0405421161,Participating,https://sites.uw.edu/apmres/
151,WA,Seattle,,Virginia Mason Medical Center Program,0405412162,Participating,https://www.virginiamason.org/anesthesiology-residency
152,WI,Madison,,University of Wisconsin Hospitals and Clinics Program,0405621164,Participating,http://www.anesthesia.wisc.edu
153,WI,Milwaukee,,Medical College of Wisconsin Affiliated Hospitals Program,0405621165,Participating,http://www.mcw.edu/anesthesiology
154,WV,Morgantown,,West Virginia University Program,0405511163,Participating,https://medicine.hsc.wvu.edu/anesth/residents/
