,State,City,Blank,Program name,ID,Status,ERAS link
0,IL,Chicago,,McGaw Medical Center of Northwestern University Program,7851644007,Participating,http://www.feinberg.northwestern.edu/sites/dermatology/index.html
1,MA,Boston,,Brigham and Women's Hospital/Massachusetts General Hospital/Harvard Medical School Program,7852444011,Participating,http://www.hms.harvard.edu/dermatology/training/residency/residencyprogram/medicinedermatology.html
2,MD,Chevy Chase,,MedStar Health/Washington Hospital Center Program,7851044005,Participating,http://www.medstarhealth.org/education/residency-programs/
3,MN,Minneapolis,,University of Minnesota Program,7852644008,Participating,http://www.dermatology.umn.edu
4,PA,Philadelphia,,University of Pennsylvania Health System Program,7854144002,Participating,http://www.uphs.upenn.edu/internal-medicine-residency/our_program/tracks_med_derm.html
