,State,City,Blank,Program name,ID,Status,ERAS link
0,CA,Sacramento,,University of California Davis Health Program,7200544004,Participating,https://health.ucdavis.edu/psychiatry/education/residency/combfam/index.html
1,CA,San Diego,,University of California (San Diego) Medical Center Program,7200544005,Participating,http://www.combinedresidency.org
2,IA,Iowa City,,University of Iowa Hospitals and Clinics Program,7201844009,Participating,https://gme.medicine.uiowa.edu/family-medicine-psychiatry-residency
3,MA,Boston,,Boston University Medical Center Program,7202400001,Participating,https://www.bumc.bu.edu/psychiatry/education-2/family-medicine-psychiatry-combined-residency-program
4,OH,Cincinnati,,University of Cincinnati Medical Center/College of Medicine Program,7203844006,Participating,http://www.psychiatry.uc.edu/fmp
5,PA,Pittsburgh,,UPMC Medical Education Program,7204144015,Participating,http://www.wpic.pitt.edu/education/residency_training/default.htm
