,Specialty,Program,Link suffix
226,Internal Medicine - Categorical Track,Cleveland Clinic Foundation/Fairview Hospital Program,/Program/GetById/1888
227,Internal Medicine - Categorical Track,Case Western Reserve University/University Hospitals Cleveland Medical Center Program,/Program/GetById/1886
228,Internal Medicine - Categorical Track,University of Cincinnati Medical Center/College of Medicine Program,/Program/GetById/1884
229,Internal Medicine - Categorical Track,Canton Medical Education Foundation/NEOMED Program,/Program/GetById/1883
230,Internal Medicine - Categorical Track,Albert Einstein Healthcare Network/Einstein Medical Center Montgomery Program,/Program/GetById/1926
231,Internal Medicine - Categorical Track,Geisinger Health System (Danville) Program,/Program/GetById/1927
232,Internal Medicine - Categorical Track,UPMC Pinnacle Hospitals Program,/Program/GetById/1928
233,Internal Medicine - Categorical Track,Penn State Milton S Hershey Medical Center Program,/Program/GetById/1930
234,Internal Medicine - Categorical Track,HCA Healthcare/Mercer University School of Medicine/Trident Medical Center Program,/Program/GetById/1976
235,Internal Medicine - Categorical Track,HCA Healthcare Grand Strand Regional Medical Center Program,/Program/GetById/1975
236,Internal Medicine - Categorical Track,Roger Williams Medical Center Program,/Program/GetById/1973
237,Internal Medicine - Categorical Track,Brown University Program,/Program/GetById/1971
238,Internal Medicine - Categorical Track,Kent Hospital/Brown University Program,/Program/GetById/1970
239,Internal Medicine - Categorical Track,VA Caribbean Healthcare System Program,/Program/GetById/1968
240,Internal Medicine - Categorical Track,Hospital de la Concepcion Program,/Program/GetById/1967
241,Internal Medicine - Categorical Track,University of Puerto Rico Program,/Program/GetById/1965
242,Internal Medicine - Categorical Track,Universidad Central del Caribe Program,/Program/GetById/1963
243,Internal Medicine - Categorical Track,Damas Hospital Program,/Program/GetById/1962
244,Internal Medicine - Categorical Track,Hospital Episcopal San Lucas/Ponce School of Medicine Program,/Program/GetById/1961
245,Internal Medicine - Categorical Track,Crozer-Chester Medical Center Program,/Program/GetById/1960
246,Internal Medicine - Categorical Track,Conemaugh Memorial Medical Center Program,/Program/GetById/1958
247,Internal Medicine - Categorical Track,St Luke's University Hospital Program,/Program/GetById/1957
248,Internal Medicine - Categorical Track,Medical University of South Carolina Program,/Program/GetById/1979
249,Internal Medicine - Categorical Track,UPMC Medical Education Program,/Program/GetById/1955
250,Internal Medicine - Categorical Track,University of Pennsylvania Health System Program,/Program/GetById/1953
251,Internal Medicine - Categorical Track,Sidney Kimmel Medical College at Thomas Jefferson University/TJUH Program,/Program/GetById/1951
252,Internal Medicine - Categorical Track,Temple University Hospital Program,/Program/GetById/1949
253,Internal Medicine - Categorical Track,UPMC Medical Education (McKeesport Hospital) Program,/Program/GetById/1948
254,Internal Medicine - Categorical Track,Lehigh Valley Health Network/University of South Florida College of Medicine Program,/Program/GetById/1947
255,Internal Medicine - Categorical Track,Robert Packer Hospital/Guthrie Program,/Program/GetById/1946
256,Internal Medicine - Categorical Track,Abington Memorial Hospital Program,/Program/GetById/1944
257,Internal Medicine - Categorical Track,Wellspan Health/York Hospital Program,/Program/GetById/1943
258,Internal Medicine - Categorical Track,UPMC Medical Education (Mercy) Program,/Program/GetById/1942
259,Internal Medicine - Categorical Track,Allegheny Health Network Medical Education Consortium (AGH) Program,/Program/GetById/1940
260,Internal Medicine - Categorical Track,Pennsylvania Hospital of the University of Pennsylvania Health System Program,/Program/GetById/1938
261,Internal Medicine - Categorical Track,Mercy Catholic Medical Center Program,/Program/GetById/1936
262,Internal Medicine - Categorical Track,Main Line Health System/Lankenau Medical Center Program,/Program/GetById/1934
263,Internal Medicine - Categorical Track,Albert Einstein Healthcare Network Program,/Program/GetById/1932
264,Internal Medicine - Categorical Track,Tower Health Program,/Program/GetById/1954
265,Internal Medicine - Categorical Track,SSM St Mary's Hospital-St Louis Program,/Program/GetById/1669
266,Internal Medicine - Categorical Track,HCA Healthcare Kansas City Program,/Program/GetById/1668
267,Internal Medicine - Categorical Track,Kansas City University GME Consortium (KCU-GME Consortium)/Freeman Program,/Program/GetById/1667
268,Internal Medicine - Categorical Track,HCA Healthcare: East Florida Division GME: Kendall Regional Medical Center Program,/Program/GetById/1423
269,Internal Medicine - Categorical Track,HCA Healthcare: East Florida Division GME: Aventura Hospital and Medical Center Program,/Program/GetById/1422
270,Internal Medicine - Categorical Track,Florida Atlantic University Charles E. Schmidt College of Medicine Program,/Program/GetById/1420
271,Internal Medicine - Categorical Track,University of Central Florida/HCA Healthcare GME (Greater Orlando) Program,/Program/GetById/1419
272,Internal Medicine - Categorical Track,Florida State University College of Medicine (Tallahassee) Program,/Program/GetById/1417
273,Internal Medicine - Categorical Track,Howard University Program,/Program/GetById/1415
274,Internal Medicine - Categorical Track,George Washington University Program,/Program/GetById/1413
275,Internal Medicine - Categorical Track,MedStar Health/Georgetown University Hospital Program,/Program/GetById/1411
276,Internal Medicine - Categorical Track,MedStar Health/Georgetown-Washington Hospital Center Program,/Program/GetById/1409
277,Internal Medicine - Categorical Track,Sidney Kimmel Medical College at Thomas Jefferson University/Christiana Care Health Services Program,/Program/GetById/1408
278,Internal Medicine - Categorical Track,Bayhealth Medical Center Program,/Program/GetById/1407
279,Internal Medicine - Categorical Track,Norwalk Hospital/Yale University Program,/Program/GetById/1405
280,Internal Medicine - Categorical Track,University of Connecticut Program,/Program/GetById/1403
281,Internal Medicine - Categorical Track,Griffin Hospital Program,/Program/GetById/1401
282,Internal Medicine - Categorical Track,Yale-New Haven Medical Center Program,/Program/GetById/1399
283,Internal Medicine - Categorical Track,Greenwich Hospital Association Program,/Program/GetById/1397
284,Internal Medicine - Categorical Track,St Mary's Hospital (Waterbury) Program,/Program/GetById/1395
285,Internal Medicine - Categorical Track,Stamford Hospital/Columbia University College of Physicians and Surgeons Program,/Program/GetById/1393
286,Internal Medicine - Categorical Track,Danbury Hospital Program,/Program/GetById/1392
287,Internal Medicine - Categorical Track,Quinnipiac University Frank H. Netter MD School of Medicine/St VIncent's Medical Center Program,/Program/GetById/1390
288,Internal Medicine - Categorical Track,Bridgeport Hospital/Yale University Program,/Program/GetById/1388
289,Internal Medicine - Categorical Track,Yale-New Haven Medical Center (Waterbury) Program,/Program/GetById/1386
290,Internal Medicine - Categorical Track,Saint Joseph Hospital Program,/Program/GetById/1384
291,Internal Medicine - Categorical Track,University of Colorado Program,/Program/GetById/1382
292,Internal Medicine - Categorical Track,HCA HealthONE Program,/Program/GetById/1381
293,Internal Medicine - Categorical Track,Parkview Medical Center Program,/Program/GetById/1380
294,Internal Medicine - Categorical Track,Santa Clara Valley Medical Center Program,/Program/GetById/1378
295,Internal Medicine - Categorical Track,Alameda Health System-Highland Hospital Program,/Program/GetById/1376
296,Internal Medicine - Categorical Track,St Mary Medical Center Program,/Program/GetById/1374
297,Internal Medicine - Categorical Track,HCA Healthcare/USF Morsani College of Medicine GME: Oak Hill Hospital Program,/Program/GetById/1424
298,Internal Medicine - Categorical Track,University of Miami Hospital and Clinics/Holy Cross Hospital Program,/Program/GetById/1426
299,Internal Medicine - Categorical Track,HCA Healthcare/Mercer University School of Medicine/Orange Park Medical Center Program,/Program/GetById/1428
300,Internal Medicine - Categorical Track,University of Central Florida/HCA Healthcare GME (Gainesville) Program,/Program/GetById/1429
301,Internal Medicine - Categorical Track,Augusta University/University of Georgia Medical Partnership Program,/Program/GetById/1471
302,Internal Medicine - Categorical Track,Northside Hospital - Gwinnett Program,/Program/GetById/1469
303,Internal Medicine - Categorical Track,AdventHealth Florida (Orlando) Program,/Program/GetById/1468
304,Internal Medicine - Categorical Track,University of Miami/JFK Medical Center Palm Beach Regional GME Consortium Program,/Program/GetById/1466
305,Internal Medicine - Categorical Track,Orlando Health Program,/Program/GetById/1464
306,Internal Medicine - Categorical Track,Cleveland Clinic (Florida) Program,/Program/GetById/1462
307,Internal Medicine - Categorical Track,Mayo Clinic College of Medicine and Science (Jacksonville) Program,/Program/GetById/1461
308,Internal Medicine - Categorical Track,University of South Florida Morsani Program,/Program/GetById/1459
309,Internal Medicine - Categorical Track,University of Miami/Jackson Health System Program,/Program/GetById/1457
310,Internal Medicine - Categorical Track,University of Florida College of Medicine Jacksonville Program,/Program/GetById/1455
311,Internal Medicine - Categorical Track,University of Florida Program,/Program/GetById/1453
312,Internal Medicine - Categorical Track,Mount Sinai Medical Center of Florida Program,/Program/GetById/1451
313,Internal Medicine - Categorical Track,HCA Healthcare/USF Morsani College of Medicine GME: Medical Center Trinity Program,/Program/GetById/1449
314,Internal Medicine - Categorical Track,Larkin Community Hospital Palm Springs Campus Program,/Program/GetById/1448
315,Internal Medicine - Categorical Track,University of California (San Francisco)/Fresno Program,/Program/GetById/1372
316,Internal Medicine - Categorical Track,HCA Healthcare/USF Morsani College of Medicine GME: Citrus Memorial Hospital Program,/Program/GetById/1446
317,Internal Medicine - Categorical Track,Palmetto General Hospital Program,/Program/GetById/1444
318,Internal Medicine - Categorical Track,Larkin Community Hospital Program,/Program/GetById/1443
319,Internal Medicine - Categorical Track,HCA Healthcare/USF Morsani College of Medicine GME: Regional Medical Center Bayonet Point Program,/Program/GetById/1442
320,Internal Medicine - Categorical Track,"Memorial Healthcare System (Hollywood, Florida) Program",/Program/GetById/1440
321,Internal Medicine - Categorical Track,University of Florida College of Medicine (Pensacola) Program,/Program/GetById/1439
322,Internal Medicine - Categorical Track,Manatee Memorial Hospital Program,/Program/GetById/1438
323,Internal Medicine - Categorical Track,Florida State University College of Medicine (Sarasota) Program,/Program/GetById/1437
324,Internal Medicine - Categorical Track,HCA Healthcare/USF Morsani College of Medicine GME: Largo Medical Center Program,/Program/GetById/1436
325,Internal Medicine - Categorical Track,Broward Health Program,/Program/GetById/1435
326,Internal Medicine - Categorical Track,HCA Healthcare/USF Morsani College of Medicine GME: Blake Medical Center Program,/Program/GetById/1434
327,Internal Medicine - Categorical Track,HCA Healthcare/USF Morsani College of Medicine GME: Northside Hospital Program,/Program/GetById/1433
328,Internal Medicine - Categorical Track,NCH Healthcare System Program,/Program/GetById/1432
329,Internal Medicine - Categorical Track,HCA Healthcare/USF Morsani College of Medicine GME: Brandon Regional Hospital Program,/Program/GetById/1431
330,Internal Medicine - Categorical Track,University of Central Florida/HCA Healthcare GME (Ocala) Program,/Program/GetById/1430
331,Internal Medicine - Categorical Track,HCA Healthcare: East Florida Division GME: Westside - Northwest Program,/Program/GetById/1445
332,Internal Medicine - Categorical Track,Piedmont Athens Regional Program,/Program/GetById/1473
333,Internal Medicine - Categorical Track,Kern Medical Center Program,/Program/GetById/1371
334,Internal Medicine - Categorical Track,St Mary's Hospital and Medical Center Program,/Program/GetById/1367
335,Internal Medicine - Categorical Track,University of California Riverside School of Medicine Program,/Program/GetById/1312
336,Internal Medicine - Categorical Track,Kaiser Permanente Southern California Program,/Program/GetById/1310
337,Internal Medicine - Categorical Track,Eisenhower Medical Center Program,/Program/GetById/1308
338,Internal Medicine - Categorical Track,University of Arkansas for Medical Sciences (UAMS) College of Medicine Program,/Program/GetById/1306
339,Internal Medicine - Categorical Track,CHI St. Vincent - Hot Springs Program,/Program/GetById/1305
340,Internal Medicine - Categorical Track,Baptist Health - UAMS Program,/Program/GetById/1304
341,Internal Medicine - Categorical Track,Unity Health-White County Medical Center Program,/Program/GetById/1303
342,Internal Medicine - Categorical Track,Baptist Memorial Medical Education (Jonesboro) Program,/Program/GetById/1302
343,Internal Medicine - Categorical Track,White River Health System Program,/Program/GetById/1301
344,Internal Medicine - Categorical Track,University of Arkansas for Medical Sciences (UAMS) College of Medicine (Northwest) Program,/Program/GetById/1300
345,Internal Medicine - Categorical Track,St. Bernards Medical Center Program,/Program/GetById/1299
346,Internal Medicine - Categorical Track,Mayo Clinic College of Medicine and Science (Arizona) Program,/Program/GetById/1298
347,Internal Medicine - Categorical Track,University of Arizona College of Medicine-Tucson Program,/Program/GetById/1296
348,Internal Medicine - Categorical Track,University of Arizona College of Medicine-Phoenix Program,/Program/GetById/1294
349,Internal Medicine - Categorical Track,University of Arizona College of Medicine-Tucson (South Campus) Program,/Program/GetById/1293
350,Internal Medicine - Categorical Track,Creighton University School of Medicine (Phoenix) Program,/Program/GetById/1291
351,Internal Medicine - Categorical Track,Abrazo Health Network Program,/Program/GetById/1290
352,Internal Medicine - Categorical Track,Midwestern University GME Consortium / Canyon Vista Program,/Program/GetById/1289
353,Internal Medicine - Categorical Track,Midwestern University GME Consortium / Verde Valley Program,/Program/GetById/1288
354,Internal Medicine - Categorical Track,Midwestern University GME Consortium / Mountain Vista Program,/Program/GetById/1287
355,Internal Medicine - Categorical Track,HonorHealth Program,/Program/GetById/1285
356,Internal Medicine - Categorical Track,University of Alabama Medical Center (Montgomery) Program,/Program/GetById/1283
357,Internal Medicine - Categorical Track,University of Alabama Medical Center Program,/Program/GetById/1281
358,Internal Medicine - Categorical Track,Brookwood Baptist Health Program,/Program/GetById/1279
359,Internal Medicine - Categorical Track,USA Health Program,/Program/GetById/1277
360,Internal Medicine - Categorical Track,East Alabama Medical Center Program,/Program/GetById/1276
361,Internal Medicine - Categorical Track,Thomas Hospital Program,/Program/GetById/1275
362,Internal Medicine - Categorical Track,North Alabama Medical Center Program,/Program/GetById/1274
363,Internal Medicine - Categorical Track,Southeast Health Program,/Program/GetById/1273
364,Internal Medicine - Categorical Track,Arrowhead Regional Medical Center Program,/Program/GetById/1313
365,Internal Medicine - Categorical Track,Riverside Community Hospital/University of California Riverside School of Medicine Program,/Program/GetById/1314
366,Internal Medicine - Categorical Track,KPC Health Program,/Program/GetById/1316
367,Internal Medicine - Categorical Track,Community Memorial Health System Program,/Program/GetById/1317
368,Internal Medicine - Categorical Track,Scripps Clinic/Scripps Green Hospital Program,/Program/GetById/1366
369,Internal Medicine - Categorical Track,Stanford Health Care-Sponsored Stanford University Program,/Program/GetById/1364
370,Internal Medicine - Categorical Track,Kaiser Permanente Northern California (Santa Clara) Program,/Program/GetById/1362
371,Internal Medicine - Categorical Track,University of California (San Francisco) Program,/Program/GetById/1361
372,Internal Medicine - Categorical Track,University of California (San Diego) Medical Center Program,/Program/GetById/1359
373,Internal Medicine - Categorical Track,Olive View/UCLA Medical Center Program,/Program/GetById/1357
374,Internal Medicine - Categorical Track,University of Southern California/LAC+USC Medical Center Program,/Program/GetById/1356
375,Internal Medicine - Categorical Track,Loma Linda University Health Education Consortium Program,/Program/GetById/1354
376,Internal Medicine - Categorical Track,University of California (Irvine) Program,/Program/GetById/1352
377,Internal Medicine - Categorical Track,University of California Davis Health Program,/Program/GetById/1351
378,Internal Medicine - Categorical Track,San Joaquin General Hospital Program,/Program/GetById/1349
379,Internal Medicine - Categorical Track,California Pacific Medical Center Program,/Program/GetById/1347
380,Internal Medicine - Categorical Track,Kaiser Permanente Northern California (San Francisco) Program,/Program/GetById/1345
381,Internal Medicine - Categorical Track,Kaiser Permanente Northern California (Oakland) Program,/Program/GetById/1343
382,Internal Medicine - Categorical Track,Santa Barbara Cottage Hospital Program,/Program/GetById/1369
383,Internal Medicine - Categorical Track,Kaiser Permanente Southern California (Los Angeles) Program,/Program/GetById/1341
384,Internal Medicine - Categorical Track,Scripps Mercy Hospital Program,/Program/GetById/1338
385,Internal Medicine - Categorical Track,Huntington Memorial Hospital Program,/Program/GetById/1336
386,Internal Medicine - Categorical Track,Adventist Health White Memorial Program,/Program/GetById/1334
387,Internal Medicine - Categorical Track,UCLA David Geffen School of Medicine/UCLA Medical Center Program,/Program/GetById/1332
388,Internal Medicine - Categorical Track,Cedars-Sinai Medical Center Program,/Program/GetById/1330
389,Internal Medicine - Categorical Track,Sierra View Medical Center Program,/Program/GetById/1328
390,Internal Medicine - Categorical Track,HCA Healthcare/Los Robles Regional Medical Center Program,/Program/GetById/1326
391,Internal Medicine - Categorical Track,"Charles R Drew University of Medicine and Science, College of Medicine Program",/Program/GetById/1325
392,Internal Medicine - Categorical Track,San Ysidro Health Program,/Program/GetById/1324
393,Internal Medicine - Categorical Track,St Joseph's Medical Center Program,/Program/GetById/1323
394,Internal Medicine - Categorical Track,UHS Southern California Medical Education Consortium Program,/Program/GetById/1322
395,Internal Medicine - Categorical Track,St. Agnes Medical Center (Fresno) Program,/Program/GetById/1320
396,Internal Medicine - Categorical Track,Prime West Consortium/West Anaheim Medical Center Program,/Program/GetById/1319
397,Internal Medicine - Categorical Track,OPTI West/College Medical Center Long Beach Program,/Program/GetById/1318
398,Internal Medicine - Categorical Track,Los Angeles County-Harbor-UCLA Medical Center Program,/Program/GetById/1339
399,Internal Medicine - Categorical Track,Marshfield Clinic Program,/Program/GetById/2077
400,Internal Medicine - Categorical Track,WellStar Kennestone Regional Medical Center Program,/Program/GetById/1474
401,Internal Medicine - Categorical Track,HCA Healthcare/Mercer University School of Medicine/Coliseum Medical Centers Program,/Program/GetById/1476
402,Internal Medicine - Categorical Track,Mercy Health Program,/Program/GetById/1627
403,Internal Medicine - Categorical Track,Detroit Medical Center Corporation (Huron Valley-Sinai)) Program,/Program/GetById/1626
404,Internal Medicine - Categorical Track,Beaumont Health (Farmington Hills) Program,/Program/GetById/1625
405,Internal Medicine - Categorical Track,McLaren Health Care/Oakland/MSU Program,/Program/GetById/1624
406,Internal Medicine - Categorical Track,Metro Health University of Michigan Health (Metro Health) Program,/Program/GetById/1623
407,Internal Medicine - Categorical Track,Garden City Hospital Program,/Program/GetById/1622
408,Internal Medicine - Categorical Track,Spectrum Health Lakeland Program,/Program/GetById/1621
409,Internal Medicine - Categorical Track,Ascension Genesys Hospital Program,/Program/GetById/1620
410,Internal Medicine - Categorical Track,Henry Ford Allegiance Health Program,/Program/GetById/1619
411,Internal Medicine - Categorical Track,Wayne State University School of Medicine Program,/Program/GetById/1618
412,Internal Medicine - Categorical Track,Boston University Medical Center Program,/Program/GetById/1616
413,Internal Medicine - Categorical Track,Lahey Clinic Program,/Program/GetById/1614
414,Internal Medicine - Categorical Track,University of Massachusetts Program,/Program/GetById/1612
415,Internal Medicine - Categorical Track,MetroWest Medical Center Program,/Program/GetById/1611
416,Internal Medicine - Categorical Track,St Elizabeth's Medical Center Program,/Program/GetById/1609
417,Internal Medicine - Categorical Track,Brigham and Women's Hospital Program,/Program/GetById/1607
418,Internal Medicine - Categorical Track,Tufts Medical Center Program,/Program/GetById/1606
419,Internal Medicine - Categorical Track,Beth Israel Deaconess Medical Center Program,/Program/GetById/1604
420,Internal Medicine - Categorical Track,Salem Hospital Program,/Program/GetById/1602
421,Internal Medicine - Categorical Track,St Vincent Hospital Program,/Program/GetById/1600
422,Internal Medicine - Categorical Track,UMMS-Baystate Program,/Program/GetById/1599
423,Internal Medicine - Categorical Track,Berkshire Medical Center Program,/Program/GetById/1597
424,Internal Medicine - Categorical Track,Mount Auburn Hospital Program,/Program/GetById/1595
425,Internal Medicine - Categorical Track,Massachusetts General Hospital Program,/Program/GetById/1593
426,Internal Medicine - Categorical Track,Steward Carney Hospital Program,/Program/GetById/1591
427,Internal Medicine - Categorical Track,University of Maryland Prince George's Hospital Center Program,/Program/GetById/1588
428,Internal Medicine - Categorical Track,University of Maryland Program,/Program/GetById/1586
429,Internal Medicine - Categorical Track,MedStar Health (Baltimore) Program,/Program/GetById/1584
430,Internal Medicine - Categorical Track,Sinai Hospital of Baltimore Program,/Program/GetById/1582
431,Internal Medicine - Categorical Track,Ascension Macomb-Oakland Hospital Program,/Program/GetById/1628
432,Internal Medicine - Categorical Track,Henry Ford Macomb Hospital Program,/Program/GetById/1629
433,Internal Medicine - Categorical Track,Detroit Wayne County Health Authority (Authority Health) GME Consortium Program,/Program/GetById/1630
434,Internal Medicine - Categorical Track,McLaren Health Care/Macomb/MSU Program,/Program/GetById/1631
435,Internal Medicine - Categorical Track,Still OPTI Program,/Program/GetById/1666
436,Internal Medicine - Categorical Track,University of Mississippi Medical Center Program,/Program/GetById/1664
437,Internal Medicine - Categorical Track,North Mississippi Medical Center Program,/Program/GetById/1663
438,Internal Medicine - Categorical Track,Merit Health Wesley Program,/Program/GetById/1662
439,Internal Medicine - Categorical Track,Baptist Memorial Medical Education (Columbus) Program,/Program/GetById/1661
440,Internal Medicine - Categorical Track,Magnolia Regional Health Center Program,/Program/GetById/1660
441,Internal Medicine - Categorical Track,Hennepin Healthcare Program,/Program/GetById/1659
442,Internal Medicine - Categorical Track,Abbott-Northwestern Hospital Program,/Program/GetById/1658
443,Internal Medicine - Categorical Track,Mayo Clinic College of Medicine and Science (Rochester) Program,/Program/GetById/1656
444,Internal Medicine - Categorical Track,University of Minnesota Program,/Program/GetById/1655
445,Internal Medicine - Categorical Track,Central Michigan University College of Medicine Program,/Program/GetById/1654
446,Internal Medicine - Categorical Track,Spectrum Health/Michigan State University Program,/Program/GetById/1653
447,Internal Medicine - Categorical Track,Hurley Medical Center/Michigan State University Program,/Program/GetById/1652
448,Internal Medicine - Categorical Track,Beaumont Health (Dearborn) Program,/Program/GetById/1650
449,Internal Medicine - Categorical Track,St Agnes HealthCare Program,/Program/GetById/1580
450,Internal Medicine - Categorical Track,Detroit Medical Center/Wayne State University (Sinai Grace) Program,/Program/GetById/1649
451,Internal Medicine - Categorical Track,Western Michigan University Homer Stryker MD School of Medicine Program,/Program/GetById/1647
452,Internal Medicine - Categorical Track,Sparrow Hospital/Michigan State University Program,/Program/GetById/1646
453,Internal Medicine - Categorical Track,Detroit Medical Center/Wayne State University Program,/Program/GetById/1645
454,Internal Medicine - Categorical Track,University of Michigan Health System Program,/Program/GetById/1643
455,Internal Medicine - Categorical Track,St Mary Mercy Hospital Program,/Program/GetById/1642
456,Internal Medicine - Categorical Track,Beaumont Health (Royal Oak) Program,/Program/GetById/1641
