,Specialty,Program,Link suffix
457,Internal Medicine - Categorical Track,St Joseph Mercy Ann Arbor Program,/Program/GetById/1640
458,Internal Medicine - Categorical Track,Ascension Providence/MSUCHM Program,/Program/GetById/1639
459,Internal Medicine - Categorical Track,St Joseph Mercy-Oakland Program,/Program/GetById/1638
460,Internal Medicine - Categorical Track,Ascension St John Hospital Program,/Program/GetById/1636
461,Internal Medicine - Categorical Track,Henry Ford Hospital/Wayne State University Program,/Program/GetById/1635
462,Internal Medicine - Categorical Track,Beaumont Health (Trenton) Program,/Program/GetById/1634
463,Internal Medicine - Categorical Track,Mercy Health Grand Rapids Program,/Program/GetById/1633
464,Internal Medicine - Categorical Track,McLaren Health Care/Greater Lansing/MSU Program,/Program/GetById/1632
465,Internal Medicine - Categorical Track,McLaren Health Care/Flint/MSU Program,/Program/GetById/1648
466,Internal Medicine - Categorical Track,HCA Healthcare Redmond Regional Medical Center Program,/Program/GetById/1475
467,Internal Medicine - Categorical Track,University of Maryland Medical Center Midtown Campus  Program,/Program/GetById/1579
468,Internal Medicine - Categorical Track,Johns Hopkins University/Bayview Medical Center Program,/Program/GetById/1575
469,Internal Medicine - Categorical Track,University of Illinois College of Medicine at Chicago Program,/Program/GetById/1518
470,Internal Medicine - Categorical Track,McGaw Medical Center of Northwestern University Program,/Program/GetById/1516
471,Internal Medicine - Categorical Track,Chicago Medical School/Rosalind Franklin University of Medicine & Science Program,/Program/GetById/1515
472,Internal Medicine - Categorical Track,Cook County Health and Hospitals System Program,/Program/GetById/1514
473,Internal Medicine - Categorical Track,Loyola Medicine MacNeal Hospital Program,/Program/GetById/1513
474,Internal Medicine - Categorical Track,AMITA Health/Saint Francis Hospital Program,/Program/GetById/1511
475,Internal Medicine - Categorical Track,University of Chicago Program,/Program/GetById/1509
476,Internal Medicine - Categorical Track,AMITA Health/Saint Joseph Hospital (Chicago) Program,/Program/GetById/1507
477,Internal Medicine - Categorical Track,Rush University Medical Center Program,/Program/GetById/1505
478,Internal Medicine - Categorical Track,Loyola University Medical Center/Trinity-Mercy Chicago Program,/Program/GetById/1504
479,Internal Medicine - Categorical Track,Advocate Health Care (Advocate Illinois Masonic Medical Center) Program,/Program/GetById/1502
480,Internal Medicine - Categorical Track,Mercyhealth GME Consortium Program,/Program/GetById/1501
481,Internal Medicine - Categorical Track,Franciscan Health Olympia Fields Program,/Program/GetById/1500
482,Internal Medicine - Categorical Track,Riverside Medical Center Program,/Program/GetById/1499
483,Internal Medicine - Categorical Track,Swedish Hospital Program,/Program/GetById/1498
484,Internal Medicine - Categorical Track,Chicago Medical School/Rosalind Franklin University of Medicine & Science/Northwestern Medicine McHenry Hospital Program,/Program/GetById/1497
485,Internal Medicine - Categorical Track,University of Washington [Boise] Program,/Program/GetById/1495
486,Internal Medicine - Categorical Track,HCA Healthcare/Eastern Idaho Regional Medical Center Program,/Program/GetById/1494
487,Internal Medicine - Categorical Track,University of Hawaii Program,/Program/GetById/1492
488,Internal Medicine - Categorical Track,Tripler Army Medical Center Program,/Program/GetById/1491
489,Internal Medicine - Categorical Track,Kaiser Permanente Hawaii Program,/Program/GetById/1490
490,Internal Medicine - Categorical Track,Morehouse School of Medicine Program,/Program/GetById/1488
491,Internal Medicine - Categorical Track,The Medical Center Navicent Health/Mercer University School of Medicine Program,/Program/GetById/1486
492,Internal Medicine - Categorical Track,Medical College of Georgia Program,/Program/GetById/1484
493,Internal Medicine - Categorical Track,Emory University School of Medicine Program,/Program/GetById/1482
494,Internal Medicine - Categorical Track,HCA Healthcare/Mercer University School of Medicine/Memorial Health University Medical Center Program,/Program/GetById/1480
495,Internal Medicine - Categorical Track,WellStar Atlanta Medical Center Program,/Program/GetById/1479
496,Internal Medicine - Categorical Track,Hamilton Medical Center Program,/Program/GetById/1478
497,Internal Medicine - Categorical Track,Northeast Georgia Medical Center Program,/Program/GetById/1477
498,Internal Medicine - Categorical Track,Loyola University Medical Center Program,/Program/GetById/1520
499,Internal Medicine - Categorical Track,University of Illinois College of Medicine at Chicago/Advocate Christ Medical Center Program,/Program/GetById/1522
500,Internal Medicine - Categorical Track,Advocate Health Care (Advocate Lutheran General Hospital) Program,/Program/GetById/1524
501,Internal Medicine - Categorical Track,Southern Illinois University Program,/Program/GetById/1526
502,Internal Medicine - Categorical Track,Anne Arundel Medical Center Program,/Program/GetById/1574
503,Internal Medicine - Categorical Track,Kaiser Permanente Mid-Atlantic States Program,/Program/GetById/1573
504,Internal Medicine - Categorical Track,Maine Medical Center Program,/Program/GetById/1572
505,Internal Medicine - Categorical Track,Baton Rouge General Program,/Program/GetById/1571
506,Internal Medicine - Categorical Track,Ochsner Clinic Foundation Program,/Program/GetById/1569
507,Internal Medicine - Categorical Track,Leonard J Chabert Medical Center Program,/Program/GetById/1568
508,Internal Medicine - Categorical Track,Louisiana State University (Baton Rouge) Program,/Program/GetById/1566
509,Internal Medicine - Categorical Track,Louisiana State University (Shreveport) Program,/Program/GetById/1564
510,Internal Medicine - Categorical Track,Tulane University Program,/Program/GetById/1562
511,Internal Medicine - Categorical Track,Louisiana State University Program,/Program/GetById/1560
512,Internal Medicine - Categorical Track,LSU Health Sciences Center/University Hospital and Clinics (Lafayette) Program,/Program/GetById/1558
513,Internal Medicine - Categorical Track,University of Louisville School of Medicine Program,/Program/GetById/1556
514,Internal Medicine - Categorical Track,University of Kentucky College of Medicine Program,/Program/GetById/1554
515,Internal Medicine - Categorical Track,"Appalachian Regional Healthcare, Inc. Program",/Program/GetById/1553
516,Internal Medicine - Categorical Track,Johns Hopkins University Program,/Program/GetById/1577
517,Internal Medicine - Categorical Track,University of Kentucky College of Medicine (Bowling Green) Program,/Program/GetById/1552
518,Internal Medicine - Categorical Track,University of Kansas (Wichita) Program,/Program/GetById/1549
519,Internal Medicine - Categorical Track,University of Kansas School of Medicine Program,/Program/GetById/1547
520,Internal Medicine - Categorical Track,University of Iowa (Des Moines) Program,/Program/GetById/1545
521,Internal Medicine - Categorical Track,University of Iowa Hospitals and Clinics Program,/Program/GetById/1543
522,Internal Medicine - Categorical Track,MercyOne North Iowa Medical Center Program,/Program/GetById/1542
523,Internal Medicine - Categorical Track,Iowa Medical Education Collaborative Program,/Program/GetById/1541
524,Internal Medicine - Categorical Track,Indiana University School of Medicine Program,/Program/GetById/1540
525,Internal Medicine - Categorical Track,Indiana University Health Ball Memorial Hospital Program,/Program/GetById/1539
526,Internal Medicine - Categorical Track,St Vincent Hospital and Health Care Center Program,/Program/GetById/1537
527,Internal Medicine - Categorical Track,Indiana University School of Medicine (Southwest Indiana) Program,/Program/GetById/1535
528,Internal Medicine - Categorical Track,University of Illinois College of Medicine at Peoria Program,/Program/GetById/1534
529,Internal Medicine - Categorical Track,University of Chicago (NorthShore) Program,/Program/GetById/1532
530,Internal Medicine - Categorical Track,West Suburban Medical Center Program,/Program/GetById/1530
531,Internal Medicine - Categorical Track,Carle Foundation Hospital Program,/Program/GetById/1528
532,Internal Medicine - Categorical Track,Appalachian Osteopathic Postgraduate Training Institute Consortium/Lake Cumberland Regional Hospital Program,/Program/GetById/1551
533,Internal Medicine - Categorical Track,Medical College of Wisconsin Affiliated Hospitals Program,/Program/GetById/2078
