,Specialty,Program,Link suffix
0,Internal Medicine - Categorical Track,University of Alabama Hospital Program,/Program/GetById/1272
1,Internal Medicine - Categorical Track,Carolinas HealthCare System Blue Ridge Program,/Program/GetById/1829
2,Internal Medicine - Categorical Track,Rochester Regional Health/Unity Hospital (Rochester) Program,/Program/GetById/1827
3,Internal Medicine - Categorical Track,Jacobi Medical Center/Albert Einstein College of Medicine Program,/Program/GetById/1825
4,Internal Medicine - Categorical Track,Icahn School of Medicine at Mount Sinai (Bronx) Program,/Program/GetById/1823
5,Internal Medicine - Categorical Track,Rochester General Hospital Program,/Program/GetById/1822
6,Internal Medicine - Categorical Track,New York Medical College (Metropolitan) Program,/Program/GetById/1820
7,Internal Medicine - Categorical Track,Icahn School of Medicine at Mount Sinai (Mount Sinai Hospital) Program,/Program/GetById/1818
8,Internal Medicine - Categorical Track,University at Buffalo Program,/Program/GetById/1815
9,Internal Medicine - Categorical Track,Albany Medical Center Program,/Program/GetById/1813
10,Internal Medicine - Categorical Track,Wyckoff Heights Medical Center Program,/Program/GetById/1812
11,Internal Medicine - Categorical Track,Icahn School of Medicine at Mount Sinai (NYC Health and Hospitals: Queens) Program,/Program/GetById/1810
12,Internal Medicine - Categorical Track,Lincoln Medical and Mental Health Center Program,/Program/GetById/1807
13,Internal Medicine - Categorical Track,Zucker School of Medicine at Hofstra/Northwell at Forest Hills Hospital Program,/Program/GetById/1805
14,Internal Medicine - Categorical Track,SUNY Upstate Medical University Program,/Program/GetById/1803
15,Internal Medicine - Categorical Track,Stony Brook Medicine/University Hospital Program,/Program/GetById/1801
16,Internal Medicine - Categorical Track,SUNY Downstate Health Sciences University Program,/Program/GetById/1799
17,Internal Medicine - Categorical Track,Icahn School of Medicine at Mount Sinai (Morningside/West) Program,/Program/GetById/1797
18,Internal Medicine - Categorical Track,NYU Grossman School of Medicine Program,/Program/GetById/1795
19,Internal Medicine - Categorical Track,Montefiore Medical Center/Albert Einstein College of Medicine (Moses and Weiler Campuses) Program,/Program/GetById/1793
20,Internal Medicine - Categorical Track,Montefiore Medical Center/Albert Einstein College of Medicine (Wakefield Campus) Program,/Program/GetById/1791
21,Internal Medicine - Categorical Track,Zucker School of Medicine at Hofstra/Northwell Program,/Program/GetById/1789
22,Internal Medicine - Categorical Track,New York Presbyterian Hospital (Cornell Campus) Program,/Program/GetById/1788
23,Internal Medicine - Categorical Track,Nassau University Medical Center Program,/Program/GetById/1786
24,Internal Medicine - Categorical Track,University at Buffalo (Catholic Health System--Sisters of Charity) Program,/Program/GetById/1784
25,Internal Medicine - Categorical Track,Brooklyn Hospital Center Program,/Program/GetById/1783
26,Internal Medicine - Categorical Track,Westchester Medical Center Program,/Program/GetById/1781
27,Internal Medicine - Categorical Track,University of Rochester Program,/Program/GetById/1779
28,Internal Medicine - Categorical Track,Zucker School of Medicine at Hofstra/Northwell at Staten Island University Hospital Program,/Program/GetById/1777
29,Internal Medicine - Categorical Track,Richmond University Medical Center Program,/Program/GetById/1775
30,Internal Medicine - Categorical Track,Campbell University/Southeastern Regional Medical Center Program,/Program/GetById/1830
31,Internal Medicine - Categorical Track,New York Presbyterian Hospital (Columbia Campus) Program,/Program/GetById/1774
32,Internal Medicine - Categorical Track,Campbell University/Cape Fear Valley Medical Center Program,/Program/GetById/1831
33,Internal Medicine - Categorical Track,WakeMed Health and Hospitals Program,/Program/GetById/1833
34,Internal Medicine - Categorical Track,St Elizabeth Youngstown Hospital/NEOMED Program,/Program/GetById/1876
35,Internal Medicine - Categorical Track,Ohio State University Hospital Program,/Program/GetById/1874
36,Internal Medicine - Categorical Track,St Vincent Charity Medical Center Program,/Program/GetById/1872
37,Internal Medicine - Categorical Track,The MetroHealth System/Case Western Reserve University Program,/Program/GetById/1870
38,Internal Medicine - Categorical Track,Jewish Hospital of Cincinnati Program,/Program/GetById/1868
39,Internal Medicine - Categorical Track,Christ Hospital Program,/Program/GetById/1866
40,Internal Medicine - Categorical Track,Akron General Medical Center/NEOMED Program,/Program/GetById/1864
41,Internal Medicine - Categorical Track,Summa Health System/NEOMED Program,/Program/GetById/1862
42,Internal Medicine - Categorical Track,Mountain State Osteopathic Postdoctoral Training Institutions (MSOPTI)/Trinity Health System West Program,/Program/GetById/1861
43,Internal Medicine - Categorical Track,Mercy Health-St Rita's Medical Center Program,/Program/GetById/1860
44,Internal Medicine - Categorical Track,East Liverpool City Hospital Program,/Program/GetById/1859
45,Internal Medicine - Categorical Track,University Hospitals Osteopathic Consortium (UHOC/Parma) Program,/Program/GetById/1858
46,Internal Medicine - Categorical Track,University Hospitals Osteopathic Consortium (UHOC) Program,/Program/GetById/1857
47,Internal Medicine - Categorical Track,University Hospitals Osteopathic Consortium (UHOC/Westlake) Program,/Program/GetById/1856
48,Internal Medicine - Categorical Track,Adena Regional Medical Center Program,/Program/GetById/1855
49,Internal Medicine - Categorical Track,Kettering Health Network/Grandview Medical Center Program,/Program/GetById/1854
50,Internal Medicine - Categorical Track,Cleveland Clinic Foundation/South Pointe Hospital Program,/Program/GetById/1853
51,Internal Medicine - Categorical Track,Western Reserve Hospital  Program,/Program/GetById/1852
52,Internal Medicine - Categorical Track,Fairfield Medical Center Program,/Program/GetById/1851
53,Internal Medicine - Categorical Track,OhioHealth/Doctors Hospital Program,/Program/GetById/1850
54,Internal Medicine - Categorical Track,University of North Dakota Program,/Program/GetById/1849
55,Internal Medicine - Categorical Track,Wake Forest University School of Medicine Program,/Program/GetById/1847
56,Internal Medicine - Categorical Track,Duke University Hospital Program,/Program/GetById/1845
57,Internal Medicine - Categorical Track,University of North Carolina Hospitals Program,/Program/GetById/1843
58,Internal Medicine - Categorical Track,New Hanover Regional Medical Center Program,/Program/GetById/1841
59,Internal Medicine - Categorical Track,Vidant Medical Center/East Carolina University Program,/Program/GetById/1839
60,Internal Medicine - Categorical Track,Cone Health Program,/Program/GetById/1837
61,Internal Medicine - Categorical Track,Carolinas Medical Center Program,/Program/GetById/1835
62,Internal Medicine - Categorical Track,Mountain Area Health Education Center Program,/Program/GetById/1834
63,Internal Medicine - Categorical Track,Campbell University/Harnett Health Program,/Program/GetById/1832
64,Internal Medicine - Categorical Track,New York-Presbyterian Brooklyn Methodist Hospital Program,/Program/GetById/1772
65,Internal Medicine - Categorical Track,Maimonides Medical Center Program,/Program/GetById/1770
66,Internal Medicine - Categorical Track,Zucker School of Medicine at Hofstra/Northwell at Lenox Hill Hospital Program,/Program/GetById/1768
67,Internal Medicine - Categorical Track,Rutgers Health/St Barnabas Medical Center Program,/Program/GetById/1715
68,Internal Medicine - Categorical Track,Jersey Shore University Medical Center Program,/Program/GetById/1713
69,Internal Medicine - Categorical Track,Atlantic Health (Overlook) Program,/Program/GetById/1711
70,Internal Medicine - Categorical Track,Atlantic Health (Morristown) Program,/Program/GetById/1709
71,Internal Medicine - Categorical Track,Hackensack University Medical Center (Mountainside) Program,/Program/GetById/1707
72,Internal Medicine - Categorical Track,Rutgers Health/Monmouth Medical Center Program,/Program/GetById/1706
73,Internal Medicine - Categorical Track,Inspira Health Network/Inspira Medical Center - Mullica Hill Program,/Program/GetById/1705
74,Internal Medicine - Categorical Track,Rutgers Health/Community Medical Center Program,/Program/GetById/1704
75,Internal Medicine - Categorical Track,Ocean Medical Center Program,/Program/GetById/1703
76,Internal Medicine - Categorical Track,Hoboken University Medical Center Program,/Program/GetById/1702
77,Internal Medicine - Categorical Track,Hackensack University Medical Center Program,/Program/GetById/1701
78,Internal Medicine - Categorical Track,RowanSOM/Jefferson Health/Virtua Our Lady of Lourdes Hospital Program,/Program/GetById/1700
79,Internal Medicine - Categorical Track,Hackensack University Medical Center (Palisades) Program,/Program/GetById/1699
80,Internal Medicine - Categorical Track,Inspira Health Network/Inspira Medical Center Vineland Program,/Program/GetById/1698
81,Internal Medicine - Categorical Track,New York Medical College at St Michael's Medical Center Program,/Program/GetById/1697
82,Internal Medicine - Categorical Track,Dartmouth-Hitchcock/Mary Hitchcock Memorial Hospital Program,/Program/GetById/1695
83,Internal Medicine - Categorical Track,HCA Healthcare/Tufts University School of Medicine: Portsmouth Regional Hospital Program,/Program/GetById/1694
84,Internal Medicine - Categorical Track,University of Nevada Las Vegas (UNLV) School of Medicine Program,/Program/GetById/1692
85,Internal Medicine - Categorical Track,University of Nevada Reno School of Medicine Program,/Program/GetById/1690
86,Internal Medicine - Categorical Track,OPTI West/Valley Hospital (Las Vegas) Program,/Program/GetById/1689
87,Internal Medicine - Categorical Track,HCA Healthcare Sunrise Health Graduate Medical Education Program,/Program/GetById/1688
88,Internal Medicine - Categorical Track,University of Nebraska Medical Center College of Medicine Program,/Program/GetById/1686
89,Internal Medicine - Categorical Track,Creighton University School of Medicine (Omaha) Program,/Program/GetById/1684
90,Internal Medicine - Categorical Track,Billings Clinic Program,/Program/GetById/1682
91,Internal Medicine - Categorical Track,Mercy Hospital (St Louis) Program,/Program/GetById/1681
92,Internal Medicine - Categorical Track,University of Missouri-Kansas City School of Medicine Program,/Program/GetById/1679
93,Internal Medicine - Categorical Track,St Luke's Hospital Program,/Program/GetById/1677
94,Internal Medicine - Categorical Track,St Louis University School of Medicine Program,/Program/GetById/1675
95,Internal Medicine - Categorical Track,Washington University/B-JH/SLCH Consortium Program,/Program/GetById/1673
96,Internal Medicine - Categorical Track,Jersey Shore University Medical Center/St. Francis Medical Center Program,/Program/GetById/1717
97,Internal Medicine - Categorical Track,Cooper Medical School of Rowan University/Cooper University Hospital Program,/Program/GetById/1718
98,Internal Medicine - Categorical Track,Hackensack University Medical Center/Englewood Hospital and Medical Center Program,/Program/GetById/1720
99,Internal Medicine - Categorical Track,Rutgers Health/Jersey City Medical Center Program,/Program/GetById/1722
100,Internal Medicine - Categorical Track,Harlem Hospital Center Program,/Program/GetById/1767
101,Internal Medicine - Categorical Track,Flushing Hospital Medical Center Program,/Program/GetById/1765
102,Internal Medicine - Categorical Track,Coney Island Hospital Program,/Program/GetById/1764
103,Internal Medicine - Categorical Track,Icahn School of Medicine at Mount Sinai (NYC Health and Hospitals: Elmhurst) Program,/Program/GetById/1762
104,Internal Medicine - Categorical Track,New York-Presbyterian/Queens Program,/Program/GetById/1760
105,Internal Medicine - Categorical Track,Icahn School of Medicine at Mount Sinai (Beth Israel) Program,/Program/GetById/1758
106,Internal Medicine - Categorical Track,Montefiore Medical Center/Albert Einstein College of Medicine (New Rochelle) Program,/Program/GetById/1756
107,Internal Medicine - Categorical Track,NYU Long Island School of Medicine Program,/Program/GetById/1754
108,Internal Medicine - Categorical Track,Bassett Medical Center Program,/Program/GetById/1752
109,Internal Medicine - Categorical Track,Nuvance Health Program,/Program/GetById/1751
110,Internal Medicine - Categorical Track,Cayuga Medical Center Program,/Program/GetById/1750
111,Internal Medicine - Categorical Track,Icahn School of Medicine at Mount Sinai (South Nassau) Program,/Program/GetById/1749
112,Internal Medicine - Categorical Track,Garnet Health Medical Center Program,/Program/GetById/1748
113,Internal Medicine - Categorical Track,Arnot Ogden Medical Center Program,/Program/GetById/1747
114,Internal Medicine - Categorical Track,Cleveland Clinic Foundation Program,/Program/GetById/1877
115,Internal Medicine - Categorical Track,Samaritan Medical Center Program,/Program/GetById/1746
116,Internal Medicine - Categorical Track,Stony Brook Medicine/Southampton Hospital Program,/Program/GetById/1743
117,Internal Medicine - Categorical Track,Zucker School of Medicine at Hofstra/Northwell at Mather Hospital Program,/Program/GetById/1741
118,Internal Medicine - Categorical Track,Family Health Center at NYU Langone Program,/Program/GetById/1740
119,Internal Medicine - Categorical Track,University of New Mexico School of Medicine Program,/Program/GetById/1738
120,Internal Medicine - Categorical Track,Mountain View Regional Medical Center Program,/Program/GetById/1737
121,Internal Medicine - Categorical Track,AtlantiCare Regional Medical Center Program,/Program/GetById/1735
122,Internal Medicine - Categorical Track,Saint Peter's University Hospital/Rutgers Robert Wood Johnson Medical School Program,/Program/GetById/1733
123,Internal Medicine - Categorical Track,St Joseph's University Medical Center Program,/Program/GetById/1732
124,Internal Medicine - Categorical Track,Rutgers Health/Newark Beth Israel Medical Center Program,/Program/GetById/1730
125,Internal Medicine - Categorical Track,Rutgers Health/Trinitas Regional Medical Center Program,/Program/GetById/1729
126,Internal Medicine - Categorical Track,JFK Medical Center/Raritan Bay Medical Center Program,/Program/GetById/1728
127,Internal Medicine - Categorical Track,Capital Health Regional Medical Center Program,/Program/GetById/1727
128,Internal Medicine - Categorical Track,Rutgers Health/Robert Wood Johnson Medical School Program,/Program/GetById/1725
129,Internal Medicine - Categorical Track,Rutgers Health/New Jersey Medical School Program,/Program/GetById/1723
130,Internal Medicine - Categorical Track,St. John's Riverside Hospital Program,/Program/GetById/1744
131,Internal Medicine - Categorical Track,Mount Carmel Health System Program,/Program/GetById/1879
132,Internal Medicine - Categorical Track,OhioHealth/Riverside Methodist Hospital Program,/Program/GetById/1880
133,Internal Medicine - Categorical Track,Mercy St Vincent Medical Center/Mercy Health Partners Program,/Program/GetById/1882
134,Internal Medicine - Categorical Track,University of Texas Southwestern Medical Center Program,/Program/GetById/2022
135,Internal Medicine - Categorical Track,Methodist Hospital (Houston) Program,/Program/GetById/2021
136,Internal Medicine - Categorical Track,Methodist Health System Dallas Program,/Program/GetById/2020
137,Internal Medicine - Categorical Track,University of Texas at Austin Dell Medical School Program,/Program/GetById/2018
138,Internal Medicine - Categorical Track,William Beaumont Army Medical Center Program,/Program/GetById/2017
139,Internal Medicine - Categorical Track,Texas Tech University HSC El Paso Program,/Program/GetById/2016
140,Internal Medicine - Categorical Track,Texas Health Resources Program,/Program/GetById/2014
141,Internal Medicine - Categorical Track,Baylor All Saints Medical Center Fort Worth Program,/Program/GetById/2013
142,Internal Medicine - Categorical Track,HCA Medical City Healthcare UNT-TCU Graduate Medical Education Program,/Program/GetById/2012
143,Internal Medicine - Categorical Track,University of Texas RGV (Knapp) Program,/Program/GetById/2011
144,Internal Medicine - Categorical Track,Texas Tech University HSC El Paso/Hospitals of Providence Transmountain Campus Program,/Program/GetById/2010
145,Internal Medicine - Categorical Track,Texas Institute for Graduate Medical Education and Research (TIGMER) Program,/Program/GetById/2009
146,Internal Medicine - Categorical Track,University of Texas Health Science Center at Tyler Program,/Program/GetById/2008
147,Internal Medicine - Categorical Track,HCA Houston Healthcare (Kingwood)/University of Houston Program,/Program/GetById/2007
148,Internal Medicine - Categorical Track,HCA Healthcare Las Palmas Del Sol Program,/Program/GetById/2006
149,Internal Medicine - Categorical Track,HCA Medical City Weatherford Program,/Program/GetById/2004
150,Internal Medicine - Categorical Track,Texas A&M College of Medicine-Scott and White Medical Center (Round Rock) Program,/Program/GetById/2003
151,Internal Medicine - Categorical Track,HCA Medical City Fort Worth Program,/Program/GetById/2002
152,Internal Medicine - Categorical Track,HCA Healthcare Corpus Christi Medical Center - Bay Area Program,/Program/GetById/2001
153,Internal Medicine - Categorical Track,University of Texas RGV (DHR) Program,/Program/GetById/1999
154,Internal Medicine - Categorical Track,University of Texas Health Science Center at Tyler/Good Shepherd Medical Center (Longview) Program,/Program/GetById/1998
155,Internal Medicine - Categorical Track,Vanderbilt University Medical Center Program,/Program/GetById/1996
156,Internal Medicine - Categorical Track,University of Tennessee (Nashville) Program,/Program/GetById/1994
157,Internal Medicine - Categorical Track,University of Tennessee Program,/Program/GetById/1992
158,Internal Medicine - Categorical Track,East Tennessee State University/Quillen College of Medicine Program,/Program/GetById/1990
159,Internal Medicine - Categorical Track,Meharry Medical College Program,/Program/GetById/1988
160,Internal Medicine - Categorical Track,University of Tennessee Medical Center at Knoxville Program,/Program/GetById/1987
161,Internal Medicine - Categorical Track,University of Tennessee College of Medicine at Chattanooga Program,/Program/GetById/1986
162,Internal Medicine - Categorical Track,HCA Healthcare/TriStar Nashville Program,/Program/GetById/1985
163,Internal Medicine - Categorical Track,University of Texas Medical Branch Hospitals Program,/Program/GetById/2024
164,Internal Medicine - Categorical Track,Baylor College of Medicine Program,/Program/GetById/2026
165,Internal Medicine - Categorical Track,University of Texas Health Science Center San Antonio Joe and Teresa Lozano Long School of Medicine Program,/Program/GetById/2028
166,Internal Medicine - Categorical Track,Texas A&M College of Medicine-Scott and White Medical Center (Temple) Program,/Program/GetById/2030
167,Internal Medicine - Categorical Track,Aurora Health Care Program,/Program/GetById/2076
168,Internal Medicine - Categorical Track,University of Wisconsin Hospitals and Clinics Program,/Program/GetById/2074
169,Internal Medicine - Categorical Track,Gundersen Lutheran Medical Foundation Program,/Program/GetById/2073
170,Internal Medicine - Categorical Track,Marshall University School of Medicine Program,/Program/GetById/2071
171,Internal Medicine - Categorical Track,West Virginia University Program,/Program/GetById/2070
172,Internal Medicine - Categorical Track,Charleston Area Medical Center/West Virginia University (Charleston Division) Program,/Program/GetById/2068
173,Internal Medicine - Categorical Track,West Virginia University School of Medicine/Camden-Clark Program,/Program/GetById/2067
174,Internal Medicine - Categorical Track,Spokane Teaching Health Center Program,/Program/GetById/2066
175,Internal Medicine - Categorical Track,University of Washington Program,/Program/GetById/2064
176,Internal Medicine - Categorical Track,Virginia Mason Medical Center Program,/Program/GetById/2062
177,Internal Medicine - Categorical Track,"Elson S Floyd College of Medicine, Washington State University Program",/Program/GetById/2060
178,Internal Medicine - Categorical Track,Trios Health Program,/Program/GetById/2059
179,Internal Medicine - Categorical Track,Skagit Regional Health Program,/Program/GetById/2058
180,Internal Medicine - Categorical Track,Carilion Clinic-Virginia Tech Carilion School of Medicine Program,/Program/GetById/2056
181,Internal Medicine - Categorical Track,University of South Dakota Program,/Program/GetById/1983
182,Internal Medicine - Categorical Track,Virginia Commonwealth University Health System Program,/Program/GetById/2054
183,Internal Medicine - Categorical Track,University of Virginia Medical Center Program,/Program/GetById/2050
184,Internal Medicine - Categorical Track,HCA Healthcare LewisGale Hospital-Montgomery/VCOM Program,/Program/GetById/2049
185,Internal Medicine - Categorical Track,Sovah Health-Danville Program,/Program/GetById/2048
186,Internal Medicine - Categorical Track,Norton Community Hospital Program,/Program/GetById/2047
187,Internal Medicine - Categorical Track,HCA Healthcare LewisGale Medical Center Program,/Program/GetById/2046
188,Internal Medicine - Categorical Track,Inova Fairfax Medical Campus Program,/Program/GetById/2045
189,Internal Medicine - Categorical Track,University of Vermont Medical Center Program,/Program/GetById/2043
190,Internal Medicine - Categorical Track,University of Utah Health Program,/Program/GetById/2041
191,Internal Medicine - Categorical Track,University of Texas Health Science Center at Houston Program,/Program/GetById/2039
192,Internal Medicine - Categorical Track,Baylor University Medical Center Program,/Program/GetById/2037
193,Internal Medicine - Categorical Track,University of Texas RGV (VBMC) Program,/Program/GetById/2036
194,Internal Medicine - Categorical Track,Texas Tech University (Permian Basin) Program,/Program/GetById/2035
195,Internal Medicine - Categorical Track,Texas Tech University (Amarillo) Program,/Program/GetById/2034
196,Internal Medicine - Categorical Track,Texas Tech University Health Sciences Center at Lubbock Program,/Program/GetById/2032
197,Internal Medicine - Categorical Track,Eastern Virginia Medical School Program,/Program/GetById/2052
198,Internal Medicine - Categorical Track,University of Missouri-Columbia Program,/Program/GetById/1671
199,Internal Medicine - Categorical Track,Prisma Health/University of South Carolina SOM Columbia (Columbia) Program,/Program/GetById/1981
200,Internal Medicine - Categorical Track,Prisma Health/University of South Carolina SOM Greenville (Greenville) Program,/Program/GetById/1977
201,Internal Medicine - Categorical Track,Geisinger Health System (Wilkes-Barre) Program,/Program/GetById/1925
202,Internal Medicine - Categorical Track,St Luke’s Hospital – Anderson Campus Program,/Program/GetById/1924
203,Internal Medicine - Categorical Track,Suburban Community Hospital (Lower Bucks Hospital) Program,/Program/GetById/1923
204,Internal Medicine - Categorical Track,Lake Erie College of Osteopathic Medicine Program,/Program/GetById/1922
205,Internal Medicine - Categorical Track,St. Mary Medical Center Program,/Program/GetById/1921
206,Internal Medicine - Categorical Track,Jefferson Health Northeast Program,/Program/GetById/1920
207,Internal Medicine - Categorical Track,Suburban Community Hospital Program,/Program/GetById/1919
208,Internal Medicine - Categorical Track,Nazareth Hospital Program,/Program/GetById/1918
209,Internal Medicine - Categorical Track,Philadelphia College of Osteopathic Medicine Program,/Program/GetById/1916
210,Internal Medicine - Categorical Track,UPMC Pinnacle Hospitals/Lititz Campus Program,/Program/GetById/1915
211,Internal Medicine - Categorical Track,Oregon Health & Science University Program,/Program/GetById/1913
212,Internal Medicine - Categorical Track,Providence Health & Services - Oregon/St Vincent Hospital and Medical Center Program,/Program/GetById/1911
213,Internal Medicine - Categorical Track,Providence Health & Services - Oregon/Providence Medical Center Program,/Program/GetById/1909
214,Internal Medicine - Categorical Track,Legacy Health/Emanuel Medical Center Program,/Program/GetById/1907
215,Internal Medicine - Categorical Track,Oregon Health & Science University Hospital/Hillsboro Medical Center Program,/Program/GetById/1906
216,Internal Medicine - Categorical Track,Samaritan Health Services - Corvallis Program,/Program/GetById/1904
217,Internal Medicine - Categorical Track,University of Oklahoma School of Community Medicine (Tulsa) Program,/Program/GetById/1902
218,Internal Medicine - Categorical Track,University of Oklahoma Health Sciences Center Program,/Program/GetById/1900
219,Internal Medicine - Categorical Track,"Osteopathic Medical Education Consortium of Oklahoma, Inc. (OMECO) Program",/Program/GetById/1899
220,Internal Medicine - Categorical Track,Oklahoma State University Center for Health Sciences Program,/Program/GetById/1897
221,Internal Medicine - Categorical Track,Western Reserve Health Education/NEOMED Program,/Program/GetById/1895
222,Internal Medicine - Categorical Track,TriHealth (Good Samaritan Hospital) Program,/Program/GetById/1894
223,Internal Medicine - Categorical Track,University of Toledo Program,/Program/GetById/1892
224,Internal Medicine - Categorical Track,Kettering Health Network/Kettering Medical Center Program,/Program/GetById/1891
225,Internal Medicine - Categorical Track,Wright State University Program,/Program/GetById/1890
