,Specialty,Program,Link suffix
0,Transitional Year,Abrazo Health Network Program,/Program/GetById/5094
1,Transitional Year,AMITA Health/Resurrection Medical Center Program,/Program/GetById/5140
2,Transitional Year,AMITA Health/Saint Francis Hospital Program,/Program/GetById/5139
3,Transitional Year,AMITA Health/Saint Joseph Hospital (Chicago) Program,/Program/GetById/5136
4,Transitional Year,Ascension Macomb-Oakland Hospital Program,/Program/GetById/5167
5,Transitional Year,Ascension Providence/MSUCHM Program,/Program/GetById/5161
6,Transitional Year,Aurora Health Care Program,/Program/GetById/5255
7,Transitional Year,Baptist Health - UAMS Program,/Program/GetById/5095
8,Transitional Year,Bassett Medical Center Program,/Program/GetById/5183
9,Transitional Year,Baylor All Saints Medical Center Fort Worth Program,/Program/GetById/5236
10,Transitional Year,Beaumont Health (Dearborn & Taylor) Program,/Program/GetById/5156
11,Transitional Year,Beaumont Health (Royal Oak) Program,/Program/GetById/5162
12,Transitional Year,Beth Israel Deaconess Medical Center Program,/Program/GetById/5150
13,Transitional Year,Broadlawns Medical Center Program,/Program/GetById/5145
14,Transitional Year,BronxCare Health System Program,/Program/GetById/5192
15,Transitional Year,Brookwood Baptist Health Program,/Program/GetById/5091
16,Transitional Year,Broward Health Program,/Program/GetById/5115
17,Transitional Year,Cambridge Health Alliance Program,/Program/GetById/5149
18,Transitional Year,Campbell University/Cape Fear Valley Medical Center Program,/Program/GetById/5197
19,Transitional Year,Campbell University/Harnett Health Program,/Program/GetById/5198
20,Transitional Year,Campbell University/Sampson Regional Medical Center Program,/Program/GetById/5200
21,Transitional Year,Campbell University/Southeastern Regional Medical Center Program,/Program/GetById/5199
22,Transitional Year,Central Iowa Health System (Iowa Methodist Medical Center) Program,/Program/GetById/5146
23,Transitional Year,Christiana Care Health Services Program,/Program/GetById/5110
24,Transitional Year,Clarion Hospital Program,/Program/GetById/5225
25,Transitional Year,Coney Island Hospital Program,/Program/GetById/5190
26,Transitional Year,Crozer-Chester Medical Center Program,/Program/GetById/5218
27,Transitional Year,Damas Hospital Program,/Program/GetById/5229
28,Transitional Year,David Grant Medical Center Program,/Program/GetById/5098
29,Transitional Year,Detroit Medical Center/Wayne State University (Sinai-Grace) Program,/Program/GetById/5158
30,Transitional Year,Dwight David Eisenhower Army Medical Center Program,/Program/GetById/5128
31,Transitional Year,Eastern Connecticut Health Network Program,/Program/GetById/5109
32,Transitional Year,Emory University School of Medicine Program,/Program/GetById/5127
33,Transitional Year,Firelands Regional Medical Center Program,/Program/GetById/5209
34,Transitional Year,Garden City Hospital Program,/Program/GetById/5171
35,Transitional Year,Garnet Health Medical Center Program,/Program/GetById/5191
36,Transitional Year,Geisinger Health System Program,/Program/GetById/5221
37,Transitional Year,Gundersen Lutheran Medical Foundation Program,/Program/GetById/5254
38,Transitional Year,Hackensack University Medical Center (Palisades) Program,/Program/GetById/5179
39,Transitional Year,HCA Healthcare Grand Strand Regional Medical Center Program,/Program/GetById/5233
40,Transitional Year,HCA Healthcare Las Palmas Del Sol Program,/Program/GetById/5242
41,Transitional Year,HCA Healthcare LewisGale Hospital-Montgomery/VCOM Program,/Program/GetById/5248
42,Transitional Year,HCA Healthcare LewisGale Medical Center Program,/Program/GetById/5249
43,Transitional Year,HCA Healthcare Redmond Regional Medical Center Program,/Program/GetById/5131
44,Transitional Year,HCA Healthcare Sunrise Health Graduate Medical Education Program,/Program/GetById/5176
45,Transitional Year,HCA Healthcare Sunrise Health Graduate Medical Education/Mountainview Hospital Program,/Program/GetById/5175
46,Transitional Year,HCA Healthcare/Mercer University School of Medicine/Coliseum Medical Centers Program,/Program/GetById/5133
47,Transitional Year,HCA Healthcare/Mercer University School of Medicine/Orange Park Medical Center Program,/Program/GetById/5113
48,Transitional Year,HCA Healthcare/USF Morsani College of Medicine GME: Blake Medical Center Program,/Program/GetById/5117
49,Transitional Year,HCA Healthcare/USF Morsani College of Medicine GME: Brandon Regional Hospital Program,/Program/GetById/5119
50,Transitional Year,HCA Healthcare/USF Morsani College of Medicine GME: Largo Medical Center Program,/Program/GetById/5126
51,Transitional Year,HCA Healthcare/USF Morsani College of Medicine GME: Oak Hill Hospital Program,/Program/GetById/5114
52,Transitional Year,HCA Healthcare/USF Morsani College of Medicine GME: Regional Medical Center Bayonet Point Program,/Program/GetById/5120
53,Transitional Year,HCA Healthcare/USF Morsani College of Medicine GME: St. Petersburg General Hospital Program,/Program/GetById/5124
54,Transitional Year,HCA Healthcare: East Florida Division GME: Aventura Hospital and Medical Center Program,/Program/GetById/5112
55,Transitional Year,HCA Healthcare: East Florida Division GME: Kendall Regional Medical Center Program,/Program/GetById/5118
56,Transitional Year,HCA HealthONE Program/Sky Ridge Medical Center,/Program/GetById/5108
57,Transitional Year,HCA Houston Healthcare (Kingwood)/University of Houston Program,/Program/GetById/5243
58,Transitional Year,HCA Houston Healthcare (West)/University of Houston Program,/Program/GetById/5244
59,Transitional Year,Hennepin Healthcare Program,/Program/GetById/5172
60,Transitional Year,Henry Ford Allegiance Health Program,/Program/GetById/5166
61,Transitional Year,Henry Ford Hospital/Wayne State University Program,/Program/GetById/5157
62,Transitional Year,Hoboken University Medical Center Program,/Program/GetById/5180
63,Transitional Year,Hospital Episcopal San Lucas/Ponce School of Medicine Program,/Program/GetById/5227
64,Transitional Year,Hurley Medical Center/Michigan State University Program,/Program/GetById/5159
65,Transitional Year,Icahn School of Medicine at Mount Sinai (South Nassau) Program,/Program/GetById/5193
66,Transitional Year,Indiana University Health Ball Memorial Hospital Program,/Program/GetById/5144
67,Transitional Year,Indiana University School of Medicine/Methodist Hospital Program,/Program/GetById/5142
68,Transitional Year,Inspira Health Network/Inspira Medical Center Vineland Program,/Program/GetById/5178
69,Transitional Year,Intermountain Medical Center Program,/Program/GetById/5245
70,Transitional Year,John Peter Smith Hospital (Tarrant County Hospital District) Program,/Program/GetById/5239
71,Transitional Year,Kaweah Delta Health Care District (KDHCD) Program,/Program/GetById/5102
72,Transitional Year,Kettering Health Network/Indu and Raj Soin Medical Center Program,/Program/GetById/5210
73,Transitional Year,Kettering Health Network/Kettering Medical Center Program,/Program/GetById/5206
74,Transitional Year,KPC Health Program,/Program/GetById/5104
75,Transitional Year,Lake Erie College of Osteopathic Medicine Program,/Program/GetById/5223
76,Transitional Year,Lehigh Valley Health Network/University of South Florida College of Medicine Program,/Program/GetById/5213
77,Transitional Year,Lincoln Medical and Mental Health Center Program,/Program/GetById/5186
78,Transitional Year,Loma Linda University Health Education Consortium Program,/Program/GetById/5103
79,Transitional Year,Louis A Weiss Memorial Hospital Program,/Program/GetById/5137
80,Transitional Year,Loyola Medicine MacNeal Hospital Program,/Program/GetById/5135
81,Transitional Year,Madigan Army Medical Center Program,/Program/GetById/5252
82,Transitional Year,Mayo Clinic College of Medicine and Science (Arizona) Program,/Program/GetById/5093
83,Transitional Year,McLaren Health Care/Oakland/MSU Program,/Program/GetById/5168
84,Transitional Year,Medical College of Wisconsin Affiliated Hospitals Program,/Program/GetById/5256
85,Transitional Year,Medical University of South Carolina College of Medicine Program,/Program/GetById/5232
86,Transitional Year,Memorial Sloan Kettering Cancer Center Program,/Program/GetById/5185
87,Transitional Year,Mercy Catholic Medical Center Program,/Program/GetById/5215
88,Transitional Year,Mercy Health Grand Rapids Program,/Program/GetById/5169
89,Transitional Year,Mercy Hospital (St Louis) Program,/Program/GetById/5174
90,Transitional Year,Mercy St Vincent Medical Center/Mercy Health Partners Program,/Program/GetById/5207
91,Transitional Year,Merit Health Wesley Program,/Program/GetById/5173
92,Transitional Year,MetroWest Medical Center Program,/Program/GetById/5152
93,Transitional Year,Mount Carmel Health System Program,/Program/GetById/5204
94,Transitional Year,Mountain Area Health Education Center Program,/Program/GetById/5201
95,Transitional Year,Mountain View Regional Medical Center Program,/Program/GetById/5182
96,Transitional Year,Nassau University Medical Center Program,/Program/GetById/5196
97,Transitional Year,National Capital Consortium Program,/Program/GetById/5111
98,Transitional Year,Naval Medical Center (Portsmouth) Program,/Program/GetById/5247
99,Transitional Year,Naval Medical Center (San Diego) Program,/Program/GetById/5101
100,Transitional Year,Nazareth Hospital Program,/Program/GetById/5222
101,Transitional Year,NCH Healthcare System Program,/Program/GetById/5125
102,Transitional Year,Newton-Wellesley Hospital Program,/Program/GetById/5154
103,Transitional Year,Northside Hospital - Gwinnett Program,/Program/GetById/5129
104,Transitional Year,Nuvance Health Program,/Program/GetById/5195
105,Transitional Year,Ocean Medical Center Program,/Program/GetById/5181
106,Transitional Year,OhioHealth/Riverside Methodist Hospital Program,/Program/GetById/5205
107,Transitional Year,Philadelphia College of Osteopathic Medicine Program,/Program/GetById/5226
108,Transitional Year,Piedmont Athens Regional Program,/Program/GetById/5132
109,Transitional Year,ProMedica Monroe Regional Hospital Program,/Program/GetById/5170
110,Transitional Year,Riverside Community Hospital/University of California Riverside School of Medicine Program,/Program/GetById/5105
111,Transitional Year,Riverside Regional Medical Center Program,/Program/GetById/5246
112,Transitional Year,RowanSOM/Jefferson Health/Virtua Our Lady of Lourdes Hospital Program,/Program/GetById/5177
113,Transitional Year,San Antonio Uniformed Services Health Education Consortium Program,/Program/GetById/5240
114,Transitional Year,San Juan City Hospital Program,/Program/GetById/5228
115,Transitional Year,Santa Clara Valley Medical Center Program,/Program/GetById/5100
116,Transitional Year,Scripps Mercy Hospital Program,/Program/GetById/5099
117,Transitional Year,Spartanburg Regional Healthcare System Program,/Program/GetById/5231
118,Transitional Year,Spectrum Health/Michigan State University Program,/Program/GetById/5163
119,Transitional Year,Spokane Teaching Health Center Program,/Program/GetById/5251
120,Transitional Year,St Anthony Hospital Program,/Program/GetById/5212
121,Transitional Year,St Elizabeth Youngstown Hospital Program,/Program/GetById/5208
122,Transitional Year,St Joseph Mercy Ann Arbor Program,/Program/GetById/5155
123,Transitional Year,St Joseph Mercy-Oakland Program,/Program/GetById/5160
124,Transitional Year,St Joseph's Health Program,/Program/GetById/5184
125,Transitional Year,St Joseph's Medical Center Program,/Program/GetById/5106
126,Transitional Year,St Luke’s Hospital – Anderson Campus Program,/Program/GetById/5224
127,Transitional Year,St Luke's University Hospital Program,/Program/GetById/5214
128,Transitional Year,St Mary Mercy Hospital Program,/Program/GetById/5165
129,Transitional Year,St Vincent Hospital and Health Care Center Program,/Program/GetById/5143
130,Transitional Year,St. Agnes Medical Center (Fresno) Program,/Program/GetById/5107
131,Transitional Year,Steward Carney Hospital Program,/Program/GetById/5151
132,Transitional Year,Stony Brook Medicine Program,/Program/GetById/5188
133,Transitional Year,Suburban Community Hospital Program,/Program/GetById/5220
134,Transitional Year,Summa Health System/NEOMED Program,/Program/GetById/5203
135,Transitional Year,Tower Health Program,/Program/GetById/5217
136,Transitional Year,Tripler Army Medical Center Program,/Program/GetById/5134
137,Transitional Year,Tucson Hospitals Medical Education Program,/Program/GetById/5092
138,Transitional Year,Tufts Medical Center/Lemuel Shattuck Hospital Program,/Program/GetById/5153
139,Transitional Year,Unity Health-White County Medical Center Program,/Program/GetById/5097
140,Transitional Year,University Hospitals Osteopathic Consortium (UHOC) Program,/Program/GetById/5211
141,Transitional Year,University of Arkansas for Medical Sciences (UAMS) College of Medicine Program,/Program/GetById/5096
142,Transitional Year,University of Central Florida/HCA Healthcare GME (Gainesville) Program,/Program/GetById/5123
143,Transitional Year,University of Central Florida/HCA Healthcare GME (Greater Orlando) Program,/Program/GetById/5116
144,Transitional Year,University of Central Florida/HCA Healthcare GME (Ocala) Program,/Program/GetById/5121
145,Transitional Year,University of Chicago (NorthShore) Program,/Program/GetById/5138
146,Transitional Year,University of Illinois College of Medicine at Peoria Program,/Program/GetById/5141
147,Transitional Year,University of Kentucky College of Medicine (Bowling Green) Program,/Program/GetById/5147
148,Transitional Year,University of Maryland Medical Center Midtown Campus  Program,/Program/GetById/5148
149,Transitional Year,University of Miami Hospital and Clinics/Holy Cross Hospital Program,/Program/GetById/5122
150,Transitional Year,University of North Dakota Program,/Program/GetById/5202
151,Transitional Year,University of Puerto Rico School of Medicine Program,/Program/GetById/5230
152,Transitional Year,University of South Dakota Program,/Program/GetById/5234
153,Transitional Year,University of Tennessee Medical Center at Knoxville Program,/Program/GetById/5235
154,Transitional Year,University of Texas at Austin Dell Medical School Program,/Program/GetById/5237
155,Transitional Year,University of Texas Rio Grande Valley Program,/Program/GetById/5241
156,Transitional Year,UPMC Medical Education (Altoona) Program,/Program/GetById/5219
157,Transitional Year,UPMC Medical Education Program,/Program/GetById/5216
158,Transitional Year,Virginia Mason Medical Center Program,/Program/GetById/5250
159,Transitional Year,Wayne State University School of Medicine Program,/Program/GetById/5164
160,Transitional Year,WellStar Kennestone Regional Medical Center Program,/Program/GetById/5130
161,Transitional Year,West Virginia University Program,/Program/GetById/5253
162,Transitional Year,William Beaumont Army Medical Center Program,/Program/GetById/5238
163,Transitional Year,Zucker School of Medicine at Hofstra/Northwell at Mather Hospital Program,/Program/GetById/5187
164,Transitional Year,Zucker School of Medicine at Hofstra/Northwell at Peconic Bay Medical Center Program,/Program/GetById/5194
165,Transitional Year,Zucker School of Medicine at Hofstra/Northwell at Plainview Hospital Program,/Program/GetById/5189
